term,type,iri,label,definition,dpvtype,subclassof,hasbroader,scopenote,created,modified,vocab,namespace
ConsentControl,class,https://w3id.org/dpv/v2.0#ConsentControl,Consent Control,"The control or activity associated with obtaining, providing, withdrawing, or reaffirming consent",,https://w3id.org/dpv/v2.0#EntityInvolvement,https://w3id.org/dpv/v2.0#EntityInvolvement,,2024-05-11,,dpv,https://w3id.org/dpv/v2.0
ObtainConsent,class,https://w3id.org/dpv/v2.0#ObtainConsent,Obtain Consent,Control for obtaining consent,,https://w3id.org/dpv/v2.0#ConsentControl,https://w3id.org/dpv/v2.0#ConsentControl,Indicates how the controller or entity can obtain consent e.g. used with dpv:isExercisedAt;Indicates how the controller or entity can obtain consent e.g. used with dpv:isExercisedAt,2024-05-11,,dpv,https://w3id.org/dpv/v2.0
ProvideConsent,class,https://w3id.org/dpv/v2.0#ProvideConsent,Provide Consent,Control for providing consent,,https://w3id.org/dpv/v2.0#ConsentControl;https://w3id.org/dpv/v2.0#OptingIntoProcess,https://w3id.org/dpv/v2.0#ConsentControl;https://w3id.org/dpv/v2.0#OptingIntoProcess,Indicates how the data subject can provide consent e.g. used with dpv:isExercisedAt;Indicates how the data subject can provide consent e.g. used with dpv:isExercisedAt;Indicates how the data subject can provide consent e.g. used with dpv:isExercisedAt;Indicates how the data subject can provide consent e.g. used with dpv:isExercisedAt;Indicates how the data subject can provide consent e.g. used with dpv:isExercisedAt;Indicates how the data subject can provide consent e.g. used with dpv:isExercisedAt;Indicates how the data subject can provide consent e.g. used with dpv:isExercisedAt;Indicates how the data subject can provide consent e.g. used with dpv:isExercisedAt,2024-05-11,,dpv,https://w3id.org/dpv/v2.0
ReaffirmConsent,class,https://w3id.org/dpv/v2.0#ReaffirmConsent,Reaffirm Consent,Control for affirming consent,,https://w3id.org/dpv/v2.0#ConsentControl,https://w3id.org/dpv/v2.0#ConsentControl,Indicates how the controller (with dpv:ObtainConsent) or data subject (with dpv:ProvideConsent) can reaffirm consent e.g. used with dpv:isExercisedAt;Indicates how the controller (with dpv:ObtainConsent) or data subject (with dpv:ProvideConsent) can reaffirm consent e.g. used with dpv:isExercisedAt,2024-05-11,,dpv,https://w3id.org/dpv/v2.0
WithdrawConsent,class,https://w3id.org/dpv/v2.0#WithdrawConsent,Withdraw Consent,Control for withdrawing consent,,https://w3id.org/dpv/v2.0#ConsentControl;https://w3id.org/dpv/v2.0#WithdrawingFromProcess,https://w3id.org/dpv/v2.0#ConsentControl;https://w3id.org/dpv/v2.0#WithdrawingFromProcess,Indicates how the data subject can withdraw consent e.g. used with dpv:isExercisedAt;Indicates how the data subject can withdraw consent e.g. used with dpv:isExercisedAt;Indicates how the data subject can withdraw consent e.g. used with dpv:isExercisedAt;Indicates how the data subject can withdraw consent e.g. used with dpv:isExercisedAt;Indicates how the data subject can withdraw consent e.g. used with dpv:isExercisedAt;Indicates how the data subject can withdraw consent e.g. used with dpv:isExercisedAt;Indicates how the data subject can withdraw consent e.g. used with dpv:isExercisedAt;Indicates how the data subject can withdraw consent e.g. used with dpv:isExercisedAt,2024-05-11,,dpv,https://w3id.org/dpv/v2.0
