term,type,iri,label,definition,dpvtype,subclassof,hasbroader,scopenote,created,modified,vocab,namespace
RightExerciseRecord,class,https://w3id.org/dpv/2.0#RightExerciseRecord,Right Exercise Record,Record of a Right being exercised,https://w3id.org/dpv/2.0#OrganisationalMeasure,,https://w3id.org/dpv/2.0#Record,"This concept represents a record of one or more right exercise activities, such as those associated with a single data subject or service or entity;This concept represents a record of one or more right exercise activities, such as those associated with a single data subject or service or entity;This concept represents a record of one or more right exercise activities, such as those associated with a single data subject or service or entity",2022-11-02,,dpv,https://w3id.org/dpv/2.0
RightFulfilmentNotice,class,https://w3id.org/dpv/2.0#RightFulfilmentNotice,Right Fulfilment Notice,Notice provided regarding fulfilment of a right,https://w3id.org/dpv/2.0#OrganisationalMeasure,,https://w3id.org/dpv/2.0#RightExerciseNotice,"This notice is associated with situations where information is provided with the intention of progressing the fulfilment of a right. For example, a notice asking for more information regarding the scope of the right, or providing information on where to access the data provided under a right.;This notice is associated with situations where information is provided with the intention of progressing the fulfilment of a right. For example, a notice asking for more information regarding the scope of the right, or providing information on where to access the data provided under a right.;This notice is associated with situations where information is provided with the intention of progressing the fulfilment of a right. For example, a notice asking for more information regarding the scope of the right, or providing information on where to access the data provided under a right.",2022-11-02,,dpv,https://w3id.org/dpv/2.0
RightNonFulfilmentNotice,class,https://w3id.org/dpv/2.0#RightNonFulfilmentNotice,Right Non-Fulfilment Notice,Notice provided regarding non-fulfilment of a right,https://w3id.org/dpv/2.0#OrganisationalMeasure,,https://w3id.org/dpv/2.0#RightExerciseNotice,"This notice is associated with situations where information is provided with the intention of communicating non-fulfilment of a right. For example, to provide justifications on why a right could not be fulfilled or providing information about another entity  who should be approached for exercising this right.;This notice is associated with situations where information is provided with the intention of communicating non-fulfilment of a right. For example, to provide justifications on why a right could not be fulfilled or providing information about another entity  who should be approached for exercising this right.;This notice is associated with situations where information is provided with the intention of communicating non-fulfilment of a right. For example, to provide justifications on why a right could not be fulfilled or providing information about another entity  who should be approached for exercising this right.",2022-11-02,,dpv,https://w3id.org/dpv/2.0
RightNotice,class,https://w3id.org/dpv/2.0#RightNotice,Right Notice,"Information associated with rights, such as which rights exist, when and where they are applicable, and other relevant information",https://w3id.org/dpv/2.0#OrganisationalMeasure,,https://w3id.org/dpv/2.0#Notice,"This concept also covers information about rights exercise, with dpv:RightExerciseNotice specifically representing information provided in connection with exercising of rights. Both notices may be needed, e.g. RightNotice for providing information about existence and exercise of rights, and RightExerciseNotice for providing additional information specifically about exercise of rights - such as to request more information or provide updates on an exercised rights request;This concept also covers information about rights exercise, with dpv:RightExerciseNotice specifically representing information provided in connection with exercising of rights. Both notices may be needed, e.g. RightNotice for providing information about existence and exercise of rights, and RightExerciseNotice for providing additional information specifically about exercise of rights - such as to request more information or provide updates on an exercised rights request;This concept also covers information about rights exercise, with dpv:RightExerciseNotice specifically representing information provided in connection with exercising of rights. Both notices may be needed, e.g. RightNotice for providing information about existence and exercise of rights, and RightExerciseNotice for providing additional information specifically about exercise of rights - such as to request more information or provide updates on an exercised rights request",2024-06-16,,dpv,https://w3id.org/dpv/2.0
RightsFulfillment,class,https://w3id.org/dpv/2.0#RightsFulfillment,Rights Fulfillment,Purposes associated with the fulfillment of rights specified in law,https://w3id.org/dpv/2.0#Purpose,,https://w3id.org/dpv/2.0#LegalObligation,"Where Rights Fulfillment includes activities that are not legal obligations, for example conducting Identity Verification, the documentation should indicate this by expressing them as separate purposes within the same activity;Where Rights Fulfillment includes activities that are not legal obligations, for example conducting Identity Verification, the documentation should indicate this by expressing them as separate purposes within the same activity;Where Rights Fulfillment includes activities that are not legal obligations, for example conducting Identity Verification, the documentation should indicate this by expressing them as separate purposes within the same activity",2024-02-14,,dpv,https://w3id.org/dpv/2.0
RightsImpactAssessment,class,https://w3id.org/dpv/2.0#RightsImpactAssessment,Rights Impact Assessment,Impact assessment which involves determining the impact on rights and freedoms,https://w3id.org/dpv/2.0#OrganisationalMeasure,,https://w3id.org/dpv/2.0#ImpactAssessment,"The rights and freedoms may be those defined in law or other norms, and may be bound to a jurisdiction;The rights and freedoms may be those defined in law or other norms, and may be bound to a jurisdiction;The rights and freedoms may be those defined in law or other norms, and may be bound to a jurisdiction",2024-04-14,,dpv,https://w3id.org/dpv/2.0
RightsManagement,class,https://w3id.org/dpv/2.0#RightsManagement,Rights Management,Methods associated with rights management where 'rights' refer to controlling who can do what with a resource,https://w3id.org/dpv/2.0#OrganisationalMeasure,,https://w3id.org/dpv/2.0#OrganisationalMeasure,,2024-04-14,,dpv,https://w3id.org/dpv/2.0
Risk,class,https://w3id.org/dpv/2.0#Risk,Risk,"A risk or possibility or uncertainty of negative effects, impacts, or consequences",,,,"Risks can be associated with one or more different concepts such as purpose, processing, personal data, technical or organisational measure;Risks can be associated with one or more different concepts such as purpose, processing, personal data, technical or organisational measure",2020-11-18,,dpv,https://w3id.org/dpv/2.0
RiskAssessment,class,https://w3id.org/dpv/2.0#RiskAssessment,Risk Assessment,"Assessment involving identification, analysis, and evaluation of risk",https://w3id.org/dpv/2.0#OrganisationalMeasure,,https://w3id.org/dpv/2.0#Assessment,,2024-04-14,,dpv,https://w3id.org/dpv/2.0
RiskLevel,class,https://w3id.org/dpv/2.0#RiskLevel,Risk Level,The magnitude of a risk expressed as an indication to aid in its management,,,,"Risk Levels can be defined as a combination of different characteristics. For example, ISO 31073:2022 defines it as a combination of consequences and their likelihood. Another example would be the Risk Matrix where Risk Level is defined as a combination of Likelihood and Severity associated with the Risk.;Risk Levels can be defined as a combination of different characteristics. For example, ISO 31073:2022 defines it as a combination of consequences and their likelihood. Another example would be the Risk Matrix where Risk Level is defined as a combination of Likelihood and Severity associated with the Risk.",2022-07-20,,dpv,https://w3id.org/dpv/2.0
RiskMitigationMeasure,class,https://w3id.org/dpv/2.0#RiskMitigationMeasure,Risk Mitigation Measure,"Measures intended to mitigate, minimise, or prevent risk.",,https://w3id.org/dpv/2.0#TechnicalOrganisationalMeasure,https://w3id.org/dpv/2.0#TechnicalOrganisationalMeasure,,2020-11-04,,dpv,https://w3id.org/dpv/2.0
Rule,class,https://w3id.org/dpv/2.0#Rule,Rule,A rule describing a process or control that directs or determines if and how an activity should be conducted,,,,,2022-10-19,,dpv,https://w3id.org/dpv/2.0
Safeguard,class,https://w3id.org/dpv/2.0#Safeguard,Safeguard,A safeguard is a precautionary measure for the protection against or mitigation of negative effects,https://w3id.org/dpv/2.0#OrganisationalMeasure,,https://w3id.org/dpv/2.0#OrganisationalMeasure,This concept is relevant given the requirement to assert safeguards in cross-border data transfers;This concept is relevant given the requirement to assert safeguards in cross-border data transfers;This concept is relevant given the requirement to assert safeguards in cross-border data transfers,2021-09-22,,dpv,https://w3id.org/dpv/2.0
SafeguardForDataTransfer,class,https://w3id.org/dpv/2.0#SafeguardForDataTransfer,Safeguard for Data Transfer,Represents a safeguard used for data transfer. Can include technical or organisational measures.,https://w3id.org/dpv/2.0#OrganisationalMeasure,,https://w3id.org/dpv/2.0#Safeguard,,2021-09-22,,dpv,https://w3id.org/dpv/2.0
Scale,class,https://w3id.org/dpv/2.0#Scale,Scale,A measurement along some dimension,,https://w3id.org/dpv/2.0#ProcessingContext,https://w3id.org/dpv/2.0#ProcessingContext,"Scales are subjective concepts that need to be defined and interpreted within the context of their application. For example, what would be small within one context could be large within another.;Scales are subjective concepts that need to be defined and interpreted within the context of their application. For example, what would be small within one context could be large within another.",2022-06-15,,dpv,https://w3id.org/dpv/2.0
ScientificResearch,class,https://w3id.org/dpv/2.0#ScientificResearch,Scientific Research,Purposes associated with scientific research,https://w3id.org/dpv/2.0#Purpose,,https://w3id.org/dpv/2.0#ResearchAndDevelopment,,2024-02-14,,dpv,https://w3id.org/dpv/2.0
Scope,class,https://w3id.org/dpv/2.0#Scope,Scope,Indication of the extent or range or boundaries associated with(in) a context,,https://w3id.org/dpv/2.0#Context,https://w3id.org/dpv/2.0#Context,,2022-06-15,,dpv,https://w3id.org/dpv/2.0
ScoringOfIndividuals,class,https://w3id.org/dpv/2.0#ScoringOfIndividuals,Scoring of Individuals,Processing that involves scoring of individuals,https://w3id.org/dpv/2.0#EvaluationScoring,,https://w3id.org/dpv/2.0#EvaluationScoring,,2022-10-22,2022-11-30,dpv,https://w3id.org/dpv/2.0
Screen,class,https://w3id.org/dpv/2.0#Screen,Screen,to remove data for some criteria,https://w3id.org/dpv/2.0#Processing,,https://w3id.org/dpv/2.0#Transform,,2022-06-15,,dpv,https://w3id.org/dpv/2.0
Seal,class,https://w3id.org/dpv/2.0#Seal,Seal,A seal or a mark indicating proof of certification to some certification or standard,https://w3id.org/dpv/2.0#OrganisationalMeasure,,https://w3id.org/dpv/2.0#CertificationSeal,,2019-04-05,,dpv,https://w3id.org/dpv/2.0
SearchFunctionalities,class,https://w3id.org/dpv/2.0#SearchFunctionalities,Search Functionalities,"Purposes associated with providing searching, querying, or other forms of information retrieval related functionalities",https://w3id.org/dpv/2.0#Purpose,,https://w3id.org/dpv/2.0#ServiceProvision,,2022-11-09,,dpv,https://w3id.org/dpv/2.0
SecondaryImportance,class,https://w3id.org/dpv/2.0#SecondaryImportance,Secondary Importance,Indication of 'secondary' or 'minor' or 'auxiliary' importance,https://w3id.org/dpv/2.0#Importance,,https://w3id.org/dpv/2.0#Importance,,2022-02-11,,dpv,https://w3id.org/dpv/2.0
SecretSharingSchemes,class,https://w3id.org/dpv/2.0#SecretSharingSchemes,Secret Sharing Schemes,Use of secret sharing schemes where the secret can only be reconstructed through combination of sufficient number of individuals,https://w3id.org/dpv/2.0#TechnicalMeasure,,https://w3id.org/dpv/2.0#CryptographicMethods,,2022-08-17,,dpv,https://w3id.org/dpv/2.0
Sector,class,https://w3id.org/dpv/2.0#Sector,Sector,"Sector describes the area of application or domain that indicates or restricts scope for interpretation and application of purpose e.g. Agriculture, Banking",,,,"There are various sector codes used commonly to indicate the domain of an organisation or business. Examples include NACE (EU), ISIC (UN), SIC and NAICS (USA).;There are various sector codes used commonly to indicate the domain of an organisation or business. Examples include NACE (EU), ISIC (UN), SIC and NAICS (USA).",2019-04-05,,dpv,https://w3id.org/dpv/2.0
SecureMultiPartyComputation,class,https://w3id.org/dpv/2.0#SecureMultiPartyComputation,Secure Multi-Party Computation,Use of cryptographic methods for entities to jointly compute functions without revealing inputs,https://w3id.org/dpv/2.0#TechnicalMeasure,,https://w3id.org/dpv/2.0#CryptographicMethods,,2022-08-17,,dpv,https://w3id.org/dpv/2.0
SecureProcessingEnvironment,class,https://w3id.org/dpv/2.0#SecureProcessingEnvironment,Secure Processing Environment,A physical or virtual environment supported by organisational means that integrates security and compliance requirements and allows supervising data processing actions,https://w3id.org/dpv/2.0#OrganisationalMeasure,,https://w3id.org/dpv/2.0#SecurityProcedure,,2024-04-14,,dpv,https://w3id.org/dpv/2.0
SecurityAssessment,class,https://w3id.org/dpv/2.0#SecurityAssessment,Security Assessment,"Assessment of security intended to identity gaps, vulnerabilities, risks, and effectiveness of controls",https://w3id.org/dpv/2.0#OrganisationalMeasure,,https://w3id.org/dpv/2.0#RiskAssessment,,2022-08-17,,dpv,https://w3id.org/dpv/2.0
SecurityIncidentNotice,class,https://w3id.org/dpv/2.0#SecurityIncidentNotice,Security Incident Notice,A notice providing information about security incident(s),https://w3id.org/dpv/2.0#OrganisationalMeasure,,https://w3id.org/dpv/2.0#Notice,,2024-04-14,,dpv,https://w3id.org/dpv/2.0
SecurityIncidentNotification,class,https://w3id.org/dpv/2.0#SecurityIncidentNotification,Security Incident Notification,Notification of information about security incident(s),https://w3id.org/dpv/2.0#OrganisationalMeasure,,https://w3id.org/dpv/2.0#Notification,,2024-04-14,,dpv,https://w3id.org/dpv/2.0
SecurityIncidentRecord,class,https://w3id.org/dpv/2.0#SecurityIncidentRecord,Security Incident Record,Record of a security incident,https://w3id.org/dpv/2.0#OrganisationalMeasure,,https://w3id.org/dpv/2.0#RecordsOfActivities,,2024-04-14,,dpv,https://w3id.org/dpv/2.0
SecurityKnowledgeTraining,class,https://w3id.org/dpv/2.0#SecurityKnowledgeTraining,Security Knowledge Training,Training intended to increase knowledge regarding security,https://w3id.org/dpv/2.0#OrganisationalMeasure,,https://w3id.org/dpv/2.0#StaffTraining,,2022-08-17,,dpv,https://w3id.org/dpv/2.0
SecurityMethod,class,https://w3id.org/dpv/2.0#SecurityMethod,Security Method,Methods that relate to creating and providing security,https://w3id.org/dpv/2.0#TechnicalMeasure,,https://w3id.org/dpv/2.0#TechnicalMeasure,,2022-08-24,,dpv,https://w3id.org/dpv/2.0
SecurityProcedure,class,https://w3id.org/dpv/2.0#SecurityProcedure,Security Procedure,"Procedures associated with assessing, implementing, and evaluating security",https://w3id.org/dpv/2.0#OrganisationalMeasure,,https://w3id.org/dpv/2.0#OrganisationalMeasure,,2022-08-24,,dpv,https://w3id.org/dpv/2.0
SecurityRoleProcedures,class,https://w3id.org/dpv/2.0#SecurityRoleProcedures,Security Role Procedures,Procedures related to security roles,https://w3id.org/dpv/2.0#OrganisationalMeasure,,https://w3id.org/dpv/2.0#SecurityProcedure,,2022-08-17,,dpv,https://w3id.org/dpv/2.0
SellDataToThirdParties,class,https://w3id.org/dpv/2.0#SellDataToThirdParties,Sell Data to Third Parties,Purposes associated with selling or sharing data or information to third parties,https://w3id.org/dpv/2.0#Purpose,,https://w3id.org/dpv/2.0#SellProducts,"Sell here means exchange, submit, or provide in return for direct or indirect compensation. Was subclass of commercial interest, changed to reflect selling something;Sell here means exchange, submit, or provide in return for direct or indirect compensation. Was subclass of commercial interest, changed to reflect selling something;Sell here means exchange, submit, or provide in return for direct or indirect compensation. Was subclass of commercial interest, changed to reflect selling something",2019-04-05,,dpv,https://w3id.org/dpv/2.0
SellInsightsFromData,class,https://w3id.org/dpv/2.0#SellInsightsFromData,Sell Insights from Data,Purposes associated with selling or sharing insights obtained from analysis of data,https://w3id.org/dpv/2.0#Purpose,,https://w3id.org/dpv/2.0#SellProducts,"Sell here means exchange, submit, or provide in return for direct or indirect compensation. Was subclass of commercial interest, changed to reflect selling something;Sell here means exchange, submit, or provide in return for direct or indirect compensation. Was subclass of commercial interest, changed to reflect selling something;Sell here means exchange, submit, or provide in return for direct or indirect compensation. Was subclass of commercial interest, changed to reflect selling something",2019-04-05,,dpv,https://w3id.org/dpv/2.0
SellProducts,class,https://w3id.org/dpv/2.0#SellProducts,Sell Products,Purposes associated with selling products or services,https://w3id.org/dpv/2.0#Purpose,,https://w3id.org/dpv/2.0#ServiceProvision,"Sell here means exchange, submit, or provide in return for direct or indirect compensation.;Sell here means exchange, submit, or provide in return for direct or indirect compensation.;Sell here means exchange, submit, or provide in return for direct or indirect compensation.",2021-09-08,,dpv,https://w3id.org/dpv/2.0
SellProductsToDataSubject,class,https://w3id.org/dpv/2.0#SellProductsToDataSubject,Sell Products to Data Subject,"Purposes associated with selling products or services to the user, consumer, or data subjects",https://w3id.org/dpv/2.0#Purpose,,https://w3id.org/dpv/2.0#SellProducts,Sell Products here refers to processing necessary to provide and complete a sale to customers. It should not be confused with providing services with a cost based on an established agreement.;Sell Products here refers to processing necessary to provide and complete a sale to customers. It should not be confused with providing services with a cost based on an established agreement.;Sell Products here refers to processing necessary to provide and complete a sale to customers. It should not be confused with providing services with a cost based on an established agreement.,2019-04-05,,dpv,https://w3id.org/dpv/2.0
SensitiveData,class,https://w3id.org/dpv/2.0#SensitiveData,Sensitive Data,Data deemed sensitive,,https://w3id.org/dpv/2.0#Data,https://w3id.org/dpv/2.0#Data,,2024-02-14,,dpv,https://w3id.org/dpv/2.0
SensitiveNonPersonalData,class,https://w3id.org/dpv/2.0#SensitiveNonPersonalData,Sensitive Non Personal Data,Non-personal data deemed sensitive,,https://w3id.org/dpv/2.0#SensitiveData,https://w3id.org/dpv/2.0#SensitiveData,,2024-02-14,,dpv,https://w3id.org/dpv/2.0
SensitivePersonalData,class,https://w3id.org/dpv/2.0#SensitivePersonalData,Sensitive Personal Data,"Personal data that is considered 'sensitive' in terms of privacy and/or impact, and therefore requires additional considerations and/or protection",,https://w3id.org/dpv/2.0#PersonalData,https://w3id.org/dpv/2.0#PersonalData,"Sensitivity' is a matter of context, and may be defined within legal frameworks. For GDPR, Special categories of personal data are considered a subset of sensitive data. To illustrate the difference between the two, consider the situation where Location data is collected, and which is considered 'sensitive' but not 'special'. As a probable rule, sensitive data require additional considerations whereas special category data requires additional legal basis / justifications.;Sensitivity' is a matter of context, and may be defined within legal frameworks. For GDPR, Special categories of personal data are considered a subset of sensitive data. To illustrate the difference between the two, consider the situation where Location data is collected, and which is considered 'sensitive' but not 'special'. As a probable rule, sensitive data require additional considerations whereas special category data requires additional legal basis / justifications.",2022-01-19,,dpv,https://w3id.org/dpv/2.0
SensitivityLevel,class,https://w3id.org/dpv/2.0#SensitivityLevel,Sensitivity Level,Sensitivity' reflects the risk of impact if not secured or utilised with appropriate measures and controls e.g. for sensitive data,,https://w3id.org/dpv/2.0#Severity,https://w3id.org/dpv/2.0#Severity,"ISO/IEC TS 38505-3:2021 defines 'data sensitivity' as the potential harm of unauthorised disclosure. DPV's use of the concept goes beyond disclosure as it refers to the level of safeguards or controls the data requires as a reflection of its 'sensitive' nature. To indicate quantified levels of sensitivity, e.g. ""high sensitivity"", instances of severity can be directly used or specialised;ISO/IEC TS 38505-3:2021 defines 'data sensitivity' as the potential harm of unauthorised disclosure. DPV's use of the concept goes beyond disclosure as it refers to the level of safeguards or controls the data requires as a reflection of its 'sensitive' nature. To indicate quantified levels of sensitivity, e.g. ""high sensitivity"", instances of severity can be directly used or specialised",2023-08-24,,dpv,https://w3id.org/dpv/2.0
Service,class,https://w3id.org/dpv/2.0#Service,Service,A service is a process where one entity provides some benefit or assistance to another entity,,https://w3id.org/dpv/2.0#Process,https://w3id.org/dpv/2.0#Process,Service Provider and Service Consumer reflect the roles associated with a service. 'Service' as a process is a distinct concept from the use of 'service' as a provision method in Tech extension;Service Provider and Service Consumer reflect the roles associated with a service. 'Service' as a process is a distinct concept from the use of 'service' as a provision method in Tech extension,2024-05-09,,dpv,https://w3id.org/dpv/2.0
ServiceConsumer,class,https://w3id.org/dpv/2.0#ServiceConsumer,Service Consumer,The entity that consumes or receives the service,,https://w3id.org/dpv/2.0#LegalEntity,https://w3id.org/dpv/2.0#LegalEntity,,2024-04-20,,dpv,https://w3id.org/dpv/2.0
ServiceOptimisation,class,https://w3id.org/dpv/2.0#ServiceOptimisation,Service Optimisation,Purposes associated with optimisation of services or activities,https://w3id.org/dpv/2.0#Purpose,,https://w3id.org/dpv/2.0#ServiceProvision,Subclass of ServiceProvision since optimisation is usually considered part of providing services;Subclass of ServiceProvision since optimisation is usually considered part of providing services;Subclass of ServiceProvision since optimisation is usually considered part of providing services,2019-04-05,,dpv,https://w3id.org/dpv/2.0
ServicePersonalisation,class,https://w3id.org/dpv/2.0#ServicePersonalisation,Service Personalisation,Purposes associated with providing personalisation within services or product or activities,https://w3id.org/dpv/2.0#Purpose,,https://w3id.org/dpv/2.0#ServiceProvision;https://w3id.org/dpv/2.0#Personalisation,,2019-04-05,,dpv,https://w3id.org/dpv/2.0
ServiceProvider,class,https://w3id.org/dpv/2.0#ServiceProvider,Service Provider,The entity that provides a service,,https://w3id.org/dpv/2.0#LegalEntity,https://w3id.org/dpv/2.0#LegalEntity,,2024-04-20,,dpv,https://w3id.org/dpv/2.0
ServiceProvision,class,https://w3id.org/dpv/2.0#ServiceProvision,Service Provision,Purposes associated with providing service or product or activities,https://w3id.org/dpv/2.0#Purpose,,https://w3id.org/dpv/2.0#Purpose,,2019-04-05,,dpv,https://w3id.org/dpv/2.0
ServiceRegistration,class,https://w3id.org/dpv/2.0#ServiceRegistration,Service Registration,Purposes associated with registering users and collecting information required for providing a service,https://w3id.org/dpv/2.0#Purpose,,https://w3id.org/dpv/2.0#ServiceProvision,An example of service registration is to provide a form that collects information such as preferred language or media format for downloading a movie;An example of service registration is to provide a form that collects information such as preferred language or media format for downloading a movie;An example of service registration is to provide a form that collects information such as preferred language or media format for downloading a movie,2020-11-04,,dpv,https://w3id.org/dpv/2.0
ServiceUsageAnalytics,class,https://w3id.org/dpv/2.0#ServiceUsageAnalytics,Service Usage Analytics,Purposes associated with conducting analysis and reporting related to usage of services or products,https://w3id.org/dpv/2.0#Purpose,,https://w3id.org/dpv/2.0#ServiceProvision,"Was ""UsageAnalytics"", prefixed with Service to better reflect scope;Was ""UsageAnalytics"", prefixed with Service to better reflect scope;Was ""UsageAnalytics"", prefixed with Service to better reflect scope",2020-11-04,2022-10-05,dpv,https://w3id.org/dpv/2.0
