term,type,iri,label,definition,dpvtype,subclassof,hasbroader,scopenote,created,modified,vocab,namespace
DataBreachRecord,class,https://w3id.org/dpv/2.0#DataBreachRecord,Data Breach Record,Record of a data breach incident,https://w3id.org/dpv/2.0#OrganisationalMeasure,,https://w3id.org/dpv/2.0#RecordsOfActivities,,2024-04-14,,dpv,https://w3id.org/dpv/2.0
DataController,class,https://w3id.org/dpv/2.0#DataController,Data Controller,The individual or organisation that decides (or controls) the purpose(s) of processing personal data.,,https://w3id.org/dpv/2.0#LegalEntity,https://w3id.org/dpv/2.0#LegalEntity,"The terms 'Controller', 'Data Controller', and 'PII Controller' refer to the same concept;The terms 'Controller', 'Data Controller', and 'PII Controller' refer to the same concept",2019-04-05,2020-11-04,dpv,https://w3id.org/dpv/2.0
DataControllerContract,class,https://w3id.org/dpv/2.0#DataControllerContract,Data Controller Contract,"Creation, completion, fulfilment, or performance of a contract, with Data Controllers as parties being Joint Data Controllers, and involving specified processing of data or technologies",https://w3id.org/dpv/2.0#LegalBasis,,https://w3id.org/dpv/2.0#Contract,,2023-12-10,,dpv,https://w3id.org/dpv/2.0
DataControllerDataSource,class,https://w3id.org/dpv/2.0#DataControllerDataSource,Data Controller as Data Source,"Data Sourced from Data Controller(s), e.g. a Controller inferring data or generating data",https://w3id.org/dpv/2.0#DataSource,,https://w3id.org/dpv/2.0#DataSource,,2023-10-12,,dpv,https://w3id.org/dpv/2.0
DataDeletionPolicy,class,https://w3id.org/dpv/2.0#DataDeletionPolicy,Data Deletion Policy,Policy regarding deletion of data,https://w3id.org/dpv/2.0#OrganisationalMeasure,,https://w3id.org/dpv/2.0#DataProcessingPolicy,Deletion and Erasure are distinct activities where deletion refers to logical removal of data with the possibility of retrieval whereas erasure refers to destruction of data such that it cannot be retrieved. See dpv:DataErasurePolicy;Deletion and Erasure are distinct activities where deletion refers to logical removal of data with the possibility of retrieval whereas erasure refers to destruction of data such that it cannot be retrieved. See dpv:DataErasurePolicy;Deletion and Erasure are distinct activities where deletion refers to logical removal of data with the possibility of retrieval whereas erasure refers to destruction of data such that it cannot be retrieved. See dpv:DataErasurePolicy,2024-04-14,,dpv,https://w3id.org/dpv/2.0
DataErasurePolicy,class,https://w3id.org/dpv/2.0#DataErasurePolicy,Data Erasure Policy,Policy regarding erasure of data,https://w3id.org/dpv/2.0#OrganisationalMeasure,,https://w3id.org/dpv/2.0#DataProcessingPolicy,Erasure or data destruction or secure removal of data refers to irreversible erasure of data. See dpv:DataDeletion for reversible or logical deletion of data;Erasure or data destruction or secure removal of data refers to irreversible erasure of data. See dpv:DataDeletion for reversible or logical deletion of data;Erasure or data destruction or secure removal of data refers to irreversible erasure of data. See dpv:DataDeletion for reversible or logical deletion of data,2024-04-14,,dpv,https://w3id.org/dpv/2.0
DataExporter,class,https://w3id.org/dpv/2.0#DataExporter,Data Exporter,An entity that 'exports' data where exporting is considered a form of data transfer,,https://w3id.org/dpv/2.0#LegalEntity,https://w3id.org/dpv/2.0#LegalEntity,"The term 'Data Exporter' is used by the EU-EDPB as the entity that transfer data across borders. While the EDPB refers to the jurisdictional border of EU, the term within DPV can be used to denote any 'export' or transfer or transmission of data and is thus a broader concept than the EDPB's definition.;The term 'Data Exporter' is used by the EU-EDPB as the entity that transfer data across borders. While the EDPB refers to the jurisdictional border of EU, the term within DPV can be used to denote any 'export' or transfer or transmission of data and is thus a broader concept than the EDPB's definition.",2021-09-08,,dpv,https://w3id.org/dpv/2.0
DataGovernance,class,https://w3id.org/dpv/2.0#DataGovernance,Data Governance,Measures associated with topics typically considered to be part of 'Data Governance',https://w3id.org/dpv/2.0#OrganisationalMeasure,,https://w3id.org/dpv/2.0#OrganisationGovernance,,2024-04-14,,dpv,https://w3id.org/dpv/2.0
DataImporter,class,https://w3id.org/dpv/2.0#DataImporter,Data Importer,An entity that 'imports' data where importing is considered a form of data transfer,,https://w3id.org/dpv/2.0#Recipient,https://w3id.org/dpv/2.0#Recipient,"The term 'Data Importer' is used by the EU-EDPB as the entity that receives transferred data across borders. While the EDPB refers to the jurisdictional border of EU, the term within DPV can be used to denote any 'import' or reception of transfer or transmission of data and is thus a broader concept than the EDPB's definition.;The term 'Data Importer' is used by the EU-EDPB as the entity that receives transferred data across borders. While the EDPB refers to the jurisdictional border of EU, the term within DPV can be used to denote any 'import' or reception of transfer or transmission of data and is thus a broader concept than the EDPB's definition.",2021-09-08,,dpv,https://w3id.org/dpv/2.0
DataInteroperabilityAssessment,class,https://w3id.org/dpv/2.0#DataInteroperabilityAssessment,Data Interoperability Assessment,Measures associated with assessment of data interoperability,https://w3id.org/dpv/2.0#OrganisationalMeasure,,https://w3id.org/dpv/2.0#DataInteroperabilityManagement;https://w3id.org/dpv/2.0#Assessment,,2024-04-14,,dpv,https://w3id.org/dpv/2.0
DataInteroperabilityImprovement,class,https://w3id.org/dpv/2.0#DataInteroperabilityImprovement,Data Interoperability Improvement,Measures associated with improvement of data interoperability,https://w3id.org/dpv/2.0#OrganisationalMeasure,,https://w3id.org/dpv/2.0#DataInteroperabilityManagement,,2024-04-14,,dpv,https://w3id.org/dpv/2.0
DataInteroperabilityManagement,class,https://w3id.org/dpv/2.0#DataInteroperabilityManagement,Data Interoperability Management,Measures associated with management of data interoperability,https://w3id.org/dpv/2.0#OrganisationalMeasure,,https://w3id.org/dpv/2.0#DataGovernance,,2024-04-14,,dpv,https://w3id.org/dpv/2.0
DataInventoryManagement,class,https://w3id.org/dpv/2.0#DataInventoryManagement,Data Inventory Management,Measures associated with management of data inventory or a data asset list,https://w3id.org/dpv/2.0#OrganisationalMeasure,,https://w3id.org/dpv/2.0#DataGovernance,,2024-04-14,,dpv,https://w3id.org/dpv/2.0
DataJurisdictionPolicy,class,https://w3id.org/dpv/2.0#DataJurisdictionPolicy,Data Jurisdiction Policy,Policy specifying jurisdictional requirements for data processing,https://w3id.org/dpv/2.0#OrganisationalMeasure,,https://w3id.org/dpv/2.0#DataProcessingPolicy,"Jurisdictional requirements can refer to data being stored within specific jurisdictions, or that data must be in line with jurisdictional laws and norms;Jurisdictional requirements can refer to data being stored within specific jurisdictions, or that data must be in line with jurisdictional laws and norms;Jurisdictional requirements can refer to data being stored within specific jurisdictions, or that data must be in line with jurisdictional laws and norms",2024-04-14,,dpv,https://w3id.org/dpv/2.0
DataLiteracy,class,https://w3id.org/dpv/2.0#DataLiteracy,Data Literacy,"Providing skills, knowledge, and understanding to enable reading, writing, analysing, reasoning, and communicating regarding data",https://w3id.org/dpv/2.0#OrganisationalMeasure,,https://w3id.org/dpv/2.0#DigitalLiteracy,,2024-05-17,,dpv,https://w3id.org/dpv/2.0
DataProcessingAgreement,class,https://w3id.org/dpv/2.0#DataProcessingAgreement,Data Processing Agreement,"An agreement outlining conditions, criteria, obligations, responsibilities, and specifics for carrying out processing of data",https://w3id.org/dpv/2.0#LegalMeasure,,https://w3id.org/dpv/2.0#LegalAgreement,"For specific role-based data processing agreements, see concepts for Processors and JointDataController agreements.;For specific role-based data processing agreements, see concepts for Processors and JointDataController agreements.;For specific role-based data processing agreements, see concepts for Processors and JointDataController agreements.",2022-01-26,,dpv,https://w3id.org/dpv/2.0
DataProcessingPolicy,class,https://w3id.org/dpv/2.0#DataProcessingPolicy,Data Processing Policy,Policy regarding data processing activities,https://w3id.org/dpv/2.0#OrganisationalMeasure,,https://w3id.org/dpv/2.0#Policy,"This only refers to the policy or plan or procedure describing how the data processing should be conducted. To represent the granular details, see further concepts e.g. dpv:DataStoragePolicy to describe policy regarding storage, or dpv:DataStorageCondition to represent information within the policy for how information should be stored;This only refers to the policy or plan or procedure describing how the data processing should be conducted. To represent the granular details, see further concepts e.g. dpv:DataStoragePolicy to describe policy regarding storage, or dpv:DataStorageCondition to represent information within the policy for how information should be stored;This only refers to the policy or plan or procedure describing how the data processing should be conducted. To represent the granular details, see further concepts e.g. dpv:DataStoragePolicy to describe policy regarding storage, or dpv:DataStorageCondition to represent information within the policy for how information should be stored",2024-04-14,,dpv,https://w3id.org/dpv/2.0
DataProcessingRecord,class,https://w3id.org/dpv/2.0#DataProcessingRecord,Data Processing Record,"Record of data processing, whether ex-ante or ex-post",https://w3id.org/dpv/2.0#OrganisationalMeasure,,https://w3id.org/dpv/2.0#RecordsOfActivities,,2021-09-08,,dpv,https://w3id.org/dpv/2.0
DataProcessor,class,https://w3id.org/dpv/2.0#DataProcessor,Data Processor,"A ‘processor’ means a natural or legal person, public authority, agency or other body which processes data on behalf of the controller.",,https://w3id.org/dpv/2.0#Recipient,https://w3id.org/dpv/2.0#Recipient,,2019-06-04,,dpv,https://w3id.org/dpv/2.0
DataProcessorContract,class,https://w3id.org/dpv/2.0#DataProcessorContract,Data Processor Contract,"Creation, completion, fulfilment, or performance of a contract, with the Data Controller and Data Processor as parties, and involving specified processing of data or technologies",https://w3id.org/dpv/2.0#LegalBasis,,https://w3id.org/dpv/2.0#Contract,,2023-12-10,,dpv,https://w3id.org/dpv/2.0
DataProtectionAuthority,class,https://w3id.org/dpv/2.0#DataProtectionAuthority,Data Protection Authority,An authority tasked with overseeing legal compliance regarding privacy and data protection laws.,,https://w3id.org/dpv/2.0#Authority,https://w3id.org/dpv/2.0#Authority,,2020-11-04,,dpv,https://w3id.org/dpv/2.0
DataProtectionOfficer,class,https://w3id.org/dpv/2.0#DataProtectionOfficer,Data Protection Officer,"An entity within or authorised by an organisation to monitor internal compliance, inform and advise on data protection obligations and act as a contact point for data subjects and the supervisory authority.",,https://w3id.org/dpv/2.0#Representative,https://w3id.org/dpv/2.0#Representative,,2020-11-04,2021-12-08,dpv,https://w3id.org/dpv/2.0
DataProtectionTraining,class,https://w3id.org/dpv/2.0#DataProtectionTraining,Data Protection Training,Training intended to increase knowledge regarding data protection,https://w3id.org/dpv/2.0#OrganisationalMeasure,,https://w3id.org/dpv/2.0#StaffTraining,,2022-08-17,,dpv,https://w3id.org/dpv/2.0
DataPublishedByDataSubject,class,https://w3id.org/dpv/2.0#DataPublishedByDataSubject,Data published by Data Subject,Data is published by the data subject,https://w3id.org/dpv/2.0#DataSubjectDataSource,,https://w3id.org/dpv/2.0#DataSubjectDataSource,This refers to where that data was made publicly available by the data subject. An example of this would be a social media profile that the data subject has made publicly accessible.;This refers to where that data was made publicly available by the data subject. An example of this would be a social media profile that the data subject has made publicly accessible.;This refers to where that data was made publicly available by the data subject. An example of this would be a social media profile that the data subject has made publicly accessible.,2022-08-24,2023-12-10,dpv,https://w3id.org/dpv/2.0
DataQualityAssessment,class,https://w3id.org/dpv/2.0#DataQualityAssessment,Data Quality Assessment,Measures associated with assessment of data quality,https://w3id.org/dpv/2.0#OrganisationalMeasure,,https://w3id.org/dpv/2.0#DataQualityManagement;https://w3id.org/dpv/2.0#Assessment,,2024-04-14,,dpv,https://w3id.org/dpv/2.0
DataQualityImprovement,class,https://w3id.org/dpv/2.0#DataQualityImprovement,Data Quality Improvement,Measures associated with improvement of data quality,https://w3id.org/dpv/2.0#OrganisationalMeasure,,https://w3id.org/dpv/2.0#DataQualityManagement,,2024-04-14,,dpv,https://w3id.org/dpv/2.0
DataQualityManagement,class,https://w3id.org/dpv/2.0#DataQualityManagement,Data Quality Management,Measures associated with management of data quality,https://w3id.org/dpv/2.0#OrganisationalMeasure,,https://w3id.org/dpv/2.0#DataGovernance,,2024-04-14,,dpv,https://w3id.org/dpv/2.0
DataRedaction,class,https://w3id.org/dpv/2.0#DataRedaction,Data Redaction,Removal of sensitive information from a data or document,https://w3id.org/dpv/2.0#TechnicalMeasure,,https://w3id.org/dpv/2.0#DataSanitisationTechnique,,2020-10-01,,dpv,https://w3id.org/dpv/2.0
DataRestorationPolicy,class,https://w3id.org/dpv/2.0#DataRestorationPolicy,Data Restoration Policy,Policy regarding restoration of data,https://w3id.org/dpv/2.0#OrganisationalMeasure,,https://w3id.org/dpv/2.0#DataProcessingPolicy,Restoration can refer to how data is restored from a backup;Restoration can refer to how data is restored from a backup;Restoration can refer to how data is restored from a backup,2024-04-14,,dpv,https://w3id.org/dpv/2.0
DataReusePolicy,class,https://w3id.org/dpv/2.0#DataReusePolicy,Data Reuse Policy,Policy regarding reuse of data i.e. using data for purposes other than its initial purpose,https://w3id.org/dpv/2.0#OrganisationalMeasure,,https://w3id.org/dpv/2.0#DataProcessingPolicy,"This policy can be used to describe the procedures associated with undertaking such reuse of data, for example to assess its legality and the compatibility of the initial and subsequent purposes;This policy can be used to describe the procedures associated with undertaking such reuse of data, for example to assess its legality and the compatibility of the initial and subsequent purposes;This policy can be used to describe the procedures associated with undertaking such reuse of data, for example to assess its legality and the compatibility of the initial and subsequent purposes",2024-04-14,,dpv,https://w3id.org/dpv/2.0
DataSanitisationTechnique,class,https://w3id.org/dpv/2.0#DataSanitisationTechnique,Data Sanitisation Technique,Cleaning or any removal or re-organisation of elements in data based on selective criteria,https://w3id.org/dpv/2.0#TechnicalMeasure,,https://w3id.org/dpv/2.0#TechnicalMeasure,,2022-08-17,,dpv,https://w3id.org/dpv/2.0
DataSecurityManagement,class,https://w3id.org/dpv/2.0#DataSecurityManagement,Data Security Management,Measures associated with management of data security,https://w3id.org/dpv/2.0#OrganisationalMeasure,,https://w3id.org/dpv/2.0#DataGovernance;https://w3id.org/dpv/2.0#SecurityProcedure,"Examples of data security management are assessing the appropriate security controls such as encryption, testing the implemented security controls, and ensuring it is protected and safeguarded from unintended actions;Examples of data security management are assessing the appropriate security controls such as encryption, testing the implemented security controls, and ensuring it is protected and safeguarded from unintended actions;Examples of data security management are assessing the appropriate security controls such as encryption, testing the implemented security controls, and ensuring it is protected and safeguarded from unintended actions;Examples of data security management are assessing the appropriate security controls such as encryption, testing the implemented security controls, and ensuring it is protected and safeguarded from unintended actions;Examples of data security management are assessing the appropriate security controls such as encryption, testing the implemented security controls, and ensuring it is protected and safeguarded from unintended actions;Examples of data security management are assessing the appropriate security controls such as encryption, testing the implemented security controls, and ensuring it is protected and safeguarded from unintended actions",2024-04-14,,dpv,https://w3id.org/dpv/2.0
DataSource,class,https://w3id.org/dpv/2.0#DataSource,Data Source,The source or origin of data,,https://w3id.org/dpv/2.0#ProcessingContext,https://w3id.org/dpv/2.0#ProcessingContext,Source' is the direct point of data collection; 'origin' would indicate the original/others points of where the data originates from.;Source' is the direct point of data collection; 'origin' would indicate the original/others points of where the data originates from.,2020-11-04,,dpv,https://w3id.org/dpv/2.0
DataStoragePolicy,class,https://w3id.org/dpv/2.0#DataStoragePolicy,Data Storage Policy,"Policy regarding storage of data, including the manner, duration, location, and conditions for storage",https://w3id.org/dpv/2.0#OrganisationalMeasure,,https://w3id.org/dpv/2.0#DataProcessingPolicy,,2024-04-14,,dpv,https://w3id.org/dpv/2.0
DataSubProcessor,class,https://w3id.org/dpv/2.0#DataSubProcessor,Data Sub-Processor,A 'sub-processor' is a processor engaged by another processor,,https://w3id.org/dpv/2.0#DataProcessor,https://w3id.org/dpv/2.0#DataProcessor,A 'Sub-Processor' is always a 'Processor' with the distinction of not directly being appointed by the 'Controller';A 'Sub-Processor' is always a 'Processor' with the distinction of not directly being appointed by the 'Controller',2020-11-25,,dpv,https://w3id.org/dpv/2.0
DataSubject,class,https://w3id.org/dpv/2.0#DataSubject,Data Subject,The individual (or category of individuals) whose personal data is being processed,,https://w3id.org/dpv/2.0#LegalEntity,https://w3id.org/dpv/2.0#LegalEntity,"The term 'data subject' is specific to the GDPR, but is functionally equivalent to the term 'individual associated with data' and the ISO/IEC term 'PII Principle';The term 'data subject' is specific to the GDPR, but is functionally equivalent to the term 'individual associated with data' and the ISO/IEC term 'PII Principle'",2019-04-05,2020-11-04,dpv,https://w3id.org/dpv/2.0
DataSubjectContract,class,https://w3id.org/dpv/2.0#DataSubjectContract,Data Subject Contract,"Creation, completion, fulfilment, or performance of a contract, with the Data Controller and Data Subject as parties, and involving specified processing of data or technologies",https://w3id.org/dpv/2.0#LegalBasis,,https://w3id.org/dpv/2.0#Contract,,2023-12-10,,dpv,https://w3id.org/dpv/2.0
DataSubjectDataSource,class,https://w3id.org/dpv/2.0#DataSubjectDataSource,Data Subject as Data Source,"Data Sourced from Data Subject(s), e.g. when data is collected via a form or observed from their activities",https://w3id.org/dpv/2.0#DataSource,,https://w3id.org/dpv/2.0#DataSource,,2023-10-12,,dpv,https://w3id.org/dpv/2.0
DataSubjectInformed,class,https://w3id.org/dpv/2.0#DataSubjectInformed,Data Subject Informed,Status indicating DataSubject has been informed about the specified context,https://w3id.org/dpv/2.0#EntityInformedStatus,,https://w3id.org/dpv/2.0#EntityInformed,,2024-05-10,,dpv,https://w3id.org/dpv/2.0
DataSubjectRight,class,https://w3id.org/dpv/2.0#DataSubjectRight,Data Subject Right,The rights applicable or provided to a Data Subject,https://w3id.org/dpv/2.0#Right,,https://w3id.org/dpv/2.0#Right,"Based on use of definitions, the notion of 'Data Subject Right' can be equivalent to 'Individual Right' or 'Right of a Person';Based on use of definitions, the notion of 'Data Subject Right' can be equivalent to 'Individual Right' or 'Right of a Person';Based on use of definitions, the notion of 'Data Subject Right' can be equivalent to 'Individual Right' or 'Right of a Person'",2020-11-18,,dpv,https://w3id.org/dpv/2.0
DataSubjectRightsManagement,class,https://w3id.org/dpv/2.0#DataSubjectRightsManagement,Data Subject Rights Management,"Methods to provide, implement, and exercise data subjects' rights",https://w3id.org/dpv/2.0#OrganisationalMeasure,,https://w3id.org/dpv/2.0#RightsManagement,"This concept only concerns the organisational management of rights, and does not represent the rights themselves - especially where such 'rights' are legally recognised or defined for the data subject or individual. The concept dpv:DataSubjectRight is provided to represent such legal rights.;This concept only concerns the organisational management of rights, and does not represent the rights themselves - especially where such 'rights' are legally recognised or defined for the data subject or individual. The concept dpv:DataSubjectRight is provided to represent such legal rights.;This concept only concerns the organisational management of rights, and does not represent the rights themselves - especially where such 'rights' are legally recognised or defined for the data subject or individual. The concept dpv:DataSubjectRight is provided to represent such legal rights.",2024-04-14,,dpv,https://w3id.org/dpv/2.0
DataSubjectScale,class,https://w3id.org/dpv/2.0#DataSubjectScale,Data Subject Scale,Scale of Data Subject(s),,https://w3id.org/dpv/2.0#Scale,https://w3id.org/dpv/2.0#Scale,,2022-06-15,,dpv,https://w3id.org/dpv/2.0
DataSubjectUninformed,class,https://w3id.org/dpv/2.0#DataSubjectUninformed,Data Subject Uninformed,Status indicating DataSubject is uninformed i.e. has not been informed about the specified context,https://w3id.org/dpv/2.0#EntityInformedStatus,,https://w3id.org/dpv/2.0#EntityUninformed,,2024-05-10,,dpv,https://w3id.org/dpv/2.0
DataTransferImpactAssessment,class,https://w3id.org/dpv/2.0#DataTransferImpactAssessment,Data Transfer Impact Assessment,Impact Assessment for conducting data transfers,https://w3id.org/dpv/2.0#OrganisationalMeasure,,https://w3id.org/dpv/2.0#ImpactAssessment,,2021-09-08,,dpv,https://w3id.org/dpv/2.0
DataTransferLegalBasis,class,https://w3id.org/dpv/2.0#DataTransferLegalBasis,Data Transfer Legal Basis,Specific or special categories and instances of legal basis intended for justifying data transfers,https://w3id.org/dpv/2.0#LegalBasis,,https://w3id.org/dpv/2.0#LegalBasis,,2021-09-08,,dpv,https://w3id.org/dpv/2.0
DataTransferNotice,class,https://w3id.org/dpv/2.0#DataTransferNotice,Data Transfer Notice,Notice for the legal entity for the transfer of its data,https://w3id.org/dpv/2.0#OrganisationalMeasure,,https://w3id.org/dpv/2.0#Notice,,2024-04-14,,dpv,https://w3id.org/dpv/2.0
DataTransferRecord,class,https://w3id.org/dpv/2.0#DataTransferRecord,Data Transfer Record,Record of data transfer activities,https://w3id.org/dpv/2.0#OrganisationalMeasure,,https://w3id.org/dpv/2.0#DataProcessingRecord,,2024-04-14,,dpv,https://w3id.org/dpv/2.0
DataVolume,class,https://w3id.org/dpv/2.0#DataVolume,Data Volume,Volume or Scale of Data,,https://w3id.org/dpv/2.0#Scale,https://w3id.org/dpv/2.0#Scale,,2022-06-15,,dpv,https://w3id.org/dpv/2.0
DecentralisedLocations,class,https://w3id.org/dpv/2.0#DecentralisedLocations,Decentralised Locations,Location that is spread across multiple separate areas with no distinction between their importance,https://w3id.org/dpv/2.0#LocationFixture,,https://w3id.org/dpv/2.0#LocationFixture,,2022-06-15,2020-10-05,dpv,https://w3id.org/dpv/2.0
DecisionMaking,class,https://w3id.org/dpv/2.0#DecisionMaking,Decision Making,Processing that involves decision making,,https://w3id.org/dpv/2.0#ProcessingContext,https://w3id.org/dpv/2.0#ProcessingContext,,2022-09-07,,dpv,https://w3id.org/dpv/2.0
Deidentification,class,https://w3id.org/dpv/2.0#Deidentification,De-Identification,Removal of identity or information to reduce identifiability,https://w3id.org/dpv/2.0#TechnicalMeasure,,https://w3id.org/dpv/2.0#DataSanitisationTechnique,,2019-04-05,2022-11-24,dpv,https://w3id.org/dpv/2.0
Delete,class,https://w3id.org/dpv/2.0#Delete,Delete,to remove data in a logical fashion i.e. with the possibility of retrieval,https://w3id.org/dpv/2.0#Processing,,https://w3id.org/dpv/2.0#Remove,,2024-04-14,,dpv,https://w3id.org/dpv/2.0
DeliveryOfGoods,class,https://w3id.org/dpv/2.0#DeliveryOfGoods,Delivery of Goods,Purposes associated with delivering goods and services requested or asked by consumer,https://w3id.org/dpv/2.0#Purpose,,https://w3id.org/dpv/2.0#RequestedServiceProvision,,2019-04-05,,dpv,https://w3id.org/dpv/2.0
Derive,class,https://w3id.org/dpv/2.0#Derive,Derive,to create new derivative data from the original data,https://w3id.org/dpv/2.0#Processing,,https://w3id.org/dpv/2.0#Obtain,"Derive indicates data is present or obtainable from existing data. For data that is created without such existence, see Infer.;Derive indicates data is present or obtainable from existing data. For data that is created without such existence, see Infer.;Derive indicates data is present or obtainable from existing data. For data that is created without such existence, see Infer.",2019-05-07,,dpv,https://w3id.org/dpv/2.0
