term,type,iri,label,definition,dpvtype,subclassof,hasbroader,scopenote,created,modified,vocab,namespace
ConsentNotice,class,https://w3id.org/dpv#ConsentNotice,Consent Notice,A Notice for information provision associated with Consent,https://w3id.org/dpv#OrganisationalMeasure,,https://w3id.org/dpv#PrivacyNotice,,2022-06-21,,dpv,https://w3id.org/dpv
DashboardNotice,class,https://w3id.org/dpv#DashboardNotice,Dashboard Notice,A notice that is provided within a dashboard also used for other purposes,https://w3id.org/dpv#OrganisationalMeasure,,https://w3id.org/dpv#Notice,,2024-08-17,,dpv,https://w3id.org/dpv
DataBreachNotice,class,https://w3id.org/dpv#DataBreachNotice,Data Breach Notice,"A notice providing information about data breach(es) i.e. unauthorised transfer, access, use, or modification of data",https://w3id.org/dpv#OrganisationalMeasure,,https://w3id.org/dpv#SecurityIncidentNotice,,2024-04-14,,dpv,https://w3id.org/dpv
DataTransferNotice,class,https://w3id.org/dpv#DataTransferNotice,Data Transfer Notice,Notice for the legal entity for the transfer of its data,https://w3id.org/dpv#OrganisationalMeasure,,https://w3id.org/dpv#Notice,,2024-04-14,,dpv,https://w3id.org/dpv
DeviceNotice,class,https://w3id.org/dpv#DeviceNotice,Device Notice,A notice provided using the functionality provided by a device e.g. using the popup or alert feature,https://w3id.org/dpv#OrganisationalMeasure,,https://w3id.org/dpv#Notice,,2024-08-17,,dpv,https://w3id.org/dpv
GraphicalNotice,class,https://w3id.org/dpv#GraphicalNotice,Graphical Notice,A notice that uses graphical elements such as visualisations and icons,https://w3id.org/dpv#OrganisationalMeasure,,https://w3id.org/dpv#Notice,,2024-08-17,,dpv,https://w3id.org/dpv
JITNotice,class,https://w3id.org/dpv#JITNotice,Just-in-time Notice,"A notice that is provided ""just in time"" when collecting information or performing an activity",https://w3id.org/dpv#OrganisationalMeasure,,https://w3id.org/dpv#Notice,,2024-08-17,,dpv,https://w3id.org/dpv
LayeredNotice,class,https://w3id.org/dpv#LayeredNotice,Layered Notice,A notice that contains layered elements,https://w3id.org/dpv#OrganisationalMeasure,,https://w3id.org/dpv#Notice,,2024-08-17,,dpv,https://w3id.org/dpv
Notice,class,https://w3id.org/dpv#Notice,Notice,"A notice is an artefact for providing information, choices, or controls",https://w3id.org/dpv#OrganisationalMeasure,,https://w3id.org/dpv#OrganisationalMeasure,"Notice refers to the information whereas Notification refers to the provision of that notice. In several cases, they are used interchangeably - for example Privacy Notice as a measure or control refers to both the information as well as the act of making it available. For 'active' contexts where this distinction is important, e.g. data breach notifications, see Notification concept.",2021-09-08,,dpv,https://w3id.org/dpv
NoticeCommunicated,class,https://w3id.org/dpv#NoticeCommunicated,Notice Communicated,Status indicating the notice has been communicated,https://w3id.org/dpv#NoticeStatus,,https://w3id.org/dpv#NoticeStatus,,2024-12-01,,dpv,https://w3id.org/dpv
NoticeGenerated,class,https://w3id.org/dpv#NoticeGenerated,Notice Generated,Status indicating the notice has been generated,https://w3id.org/dpv#NoticeStatus,,https://w3id.org/dpv#NoticeStatus,,2024-12-01,,dpv,https://w3id.org/dpv
NoticeIcon,class,https://w3id.org/dpv#NoticeIcon,Notice Icon,An icon within a notice associated with specific information or elements,,,,,2024-08-17,,dpv,https://w3id.org/dpv
NoticeLatest,class,https://w3id.org/dpv#NoticeLatest,Notice Latest,Status indicating the notice is currently at its latest iteration,https://w3id.org/dpv#NoticeStatus,,https://w3id.org/dpv#NoticeStatus,,2024-12-01,,dpv,https://w3id.org/dpv
NoticeLayer,class,https://w3id.org/dpv#NoticeLayer,Notice Layer,A layer within a layered notice where the layer can be used for providing specific information or controls,,,,,2024-08-17,,dpv,https://w3id.org/dpv
NoticeStale,class,https://w3id.org/dpv#NoticeStale,Notice Stale,Status indicating the notice is stale or not up to date or not the latest version,https://w3id.org/dpv#NoticeStatus,,https://w3id.org/dpv#NoticeStatus,,2024-12-01,,dpv,https://w3id.org/dpv
NoticeStatus,class,https://w3id.org/dpv#NoticeStatus,Notice Status,"Status associated with notice provision, use, and management",,https://w3id.org/dpv#Status,https://w3id.org/dpv#Status,,2024-12-01,,dpv,https://w3id.org/dpv
NoticeUnused,class,https://w3id.org/dpv#NoticeUnused,Notice Unused,Status indicating the notice has been communicated but has not yet been used e.g. the recipient has not acknowledged it or has not taken the intended action,https://w3id.org/dpv#NoticeStatus,,https://w3id.org/dpv#NoticeStatus,,2024-12-01,,dpv,https://w3id.org/dpv
NoticeUpdated,class,https://w3id.org/dpv#NoticeUpdated,Notice Updated,Status indicating the notice has been updated and its contents or implications have changed,https://w3id.org/dpv#NoticeStatus,,https://w3id.org/dpv#NoticeStatus,,2024-12-01,,dpv,https://w3id.org/dpv
NoticeUsed,class,https://w3id.org/dpv#NoticeUsed,Notice Used,Status indicating the notice has been communicated and has been used e.g. the recipient has acknowledged it or taken the intended action,https://w3id.org/dpv#NoticeStatus,,https://w3id.org/dpv#NoticeStatus,,2024-12-01,,dpv,https://w3id.org/dpv
OralNotice,class,https://w3id.org/dpv#OralNotice,Oral Notice,A notice provided orally or verbally,https://w3id.org/dpv#OrganisationalMeasure,,https://w3id.org/dpv#Notice,,2024-08-17,,dpv,https://w3id.org/dpv
PostedNotice,class,https://w3id.org/dpv#PostedNotice,Posted Notice,A notice that is posted as a sign or banner,https://w3id.org/dpv#OrganisationalMeasure,,https://w3id.org/dpv#Notice,,2024-08-17,,dpv,https://w3id.org/dpv
PrintedNotice,class,https://w3id.org/dpv#PrintedNotice,Printed Notice,A notice that is provided in a printed form on or along with a device,https://w3id.org/dpv#OrganisationalMeasure,,https://w3id.org/dpv#Notice,,2024-08-17,,dpv,https://w3id.org/dpv
PrivacyNotice,class,https://w3id.org/dpv#PrivacyNotice,Privacy Notice,Represents a notice or document outlining information regarding privacy,https://w3id.org/dpv#OrganisationalMeasure,,https://w3id.org/dpv#Notice,,2021-09-08,,dpv,https://w3id.org/dpv
SecurityIncidentNotice,class,https://w3id.org/dpv#SecurityIncidentNotice,Security Incident Notice,A notice providing information about security incident(s),https://w3id.org/dpv#OrganisationalMeasure,,https://w3id.org/dpv#Notice,,2024-04-14,,dpv,https://w3id.org/dpv
hasNotice,property,https://w3id.org/dpv#hasNotice,has notice,Indicates the use or applicability of a Notice for the specified context,,,https://w3id.org/dpv#hasOrganisationalMeasure,,2022-06-22,,dpv,https://w3id.org/dpv
hasNoticeIcon,property,https://w3id.org/dpv#hasNoticeIcon,has notice icon,Indicates the concept can be represented graphically using the specified icon,,,,,2024-08-17,,dpv,https://w3id.org/dpv
hasNoticeLayer,property,https://w3id.org/dpv#hasNoticeLayer,has notice layer,Indicates the use of a notice layer within a notice or to associate a layer with another layer,,,,,2024-08-17,,dpv,https://w3id.org/dpv
hasNoticeStatus,property,https://w3id.org/dpv#hasNoticeStatus,has notice status,Indicates the status of the associated notice,,,,,2024-12-01,,dpv,https://w3id.org/dpv
