"Term GDPR specific statuses in dpv-gdpr","Label ","Description ","ParentTerm ","ParentType ","Value ","RelatedTerms ","Relation ","Comment ","Source ","Created ","Modified ","Status ","Contributors ","Resolution ","","","","","","","","","","","","","","",""
"GDPRLawfulness","GDPR Lawfulness","Status or state associated with being lawful or legally compliant regarding GDPR","dpv:Lawfulness","sc","","","","","","2022-10-22","","accepted","Harshvardhan J. Pandit","","","","","","","","","","","","","","","",""
"GDPRCompliant","GDPR Compliant","State of being lawful or legally compliant for GDPR","dpv-gdpr:GDPRLawulness","a","","","","","","2022-10-22","","accepted","Harshvardhan J. Pandit","","","","","","","","","","","","","","","",""
"GDPRNonCompliant","GDPR Non-compliant","State of being unlawful or legally non-compliant for GDPR","dpv-gdpr:GDPRLawulness","a","","","","","","2022-10-22","","accepted","Harshvardhan J. Pandit","","","","","","","","","","","","","","","",""
"GDPRComplianceUnknown","GDPR Compliance Unknown","State where lawfulness or compliance with GDPR is unknown","dpv-gdpr:GDPRLawulness","a","","","","","","2022-10-22","","accepted","Harshvardhan J. Pandit","","","","","","","","","","","","","","","",""
"ProcessingPropotionality","Processing Proportionality","The evaluation of whether processing is proportional and in balance with impact to rights","","","","","","","","","","proposed","Georg P Krog","","","","","","","","","","","","","","","",""
"SystematicExtensiveEvaluation","Systematic Extensive Evaluation","The systematic and extensive evaluation of personal aspects","","","","","","","","","","proposed","Georg P Krog","","","","","","","","","","","","","","","",""