"Term","Label","Description","domain","range","ParentProperty","RelatedTerms","Relation","Comment","Source","CreationDate","Modified","Status","Contributors","Resolution","","","","","","","","","","","","",""
"hasTechnicalOrganisationalMeasure","has technical and organisational measure","Indicates use or applicability of Technical or Organisational measure","dpv:Concept","dpv:TechnicalOrganisationalMeasure","dpv:Relation","","","","","2019-04-04","2020-11-04","accepted","Axel Polleres, Javier Fernández, Harshvardhan J. Pandit, Mark Lizar, Bud Bruegger
","https://www.w3.org/2019/04/05-dpvcg-minutes.html","","","","","","","","","","","","",""
"hasTechnicalMeasure","has technical measure","Indicates use or applicability of Technical measure","dpv:Concept","dpv:TechnicalMeasure","dpv:hasTechnicalOrganisationalMeasure","","","","","2022-02-09","","accepted","Harshvardhan J. Pandit","","","","","","","","","","","","","",""
"hasOrganisationalMeasure","has organisational measure","Indicates use or applicability of Organisational measure","dpv:Concept","dpv:OrganisationalMeasure","dpv:hasTechnicalOrganisationalMeasure","","","","","2022-02-10","","accepted","Harshvardhan J. Pandit","","","","","","","","","","","","","",""
"mitigatesRisk","mitigates risk","Indicates mitigation of risk(s)","dpv:RiskMitigationMeasure","dpv:Risk","dpv:Relation","","","","","2020-11-04","","accepted","Harshvardhan J. Pandit","https://www.w3.org/community/dpvcg/wiki/Workshop20201104","","","","","","","","","","","","",""
"hasPolicy","has policy","Indicates policy applicable or used","dpv:Concept","dpv:Policy","dpv:hasTechnicalOrganisationalMeasure","","","","","2022-01-26","","accepted","Harshvardhan J. Pandit","https://www.w3.org/2022/01/26-dpvcg-minutes.html","","","","","","","","","","","","",""
"isPolicyFor","is policy for","Indicates the context or application of policy","dpv:Policy","dpv:Concept","dpv:Relation","","","","","2022-01-26","","accepted","Harshvardhan J. Pandit","https://www.w3.org/2022/01/26-dpvcg-minutes.html","","","","","","","","","","","","",""
"isRequiredFor","is required for","e.g. indicate technical measure is required for some legal obligation or satisfying some condition/constraint","","","","","","","","","","proposed","Julian Flake","","","","","","","","","","","","","",""
"isMitigatedByMeasure","is mitigated by measure","Indicate a risk is mitigated by specified measure","dpv:Risk","dpv:RiskMitigationMeasure","dpv:hasTechnicalOrganisationalMeasure","","","","","2022-02-09","","accepted","Harshvardhan J. Pandit","","","","","","","","","","","","","",""
"hasRisk","has risk","Indicates applicability of Risk","dpv:Concept","dpv:Risk","dpv:Relation","","","","","2020-11-18","","accepted","Harshvardhan J. Pandit","https://www.w3.org/2020/11/18-dpvcg-minutes.html","","","","","","","","","","","","",""