Term,Label,Definition,ParentTerm,ParentType,RelatedTerms,Relation,Source,Usage,Created,Modified,Contributors,Status,,,,,,,,,,,,,,,,
use of AI concepts,,,,,,,,,,,,,,,,,,,,,,,,,,,,
IntendedPurpose,Intended Purpose,"The use for which an AI system is intended by the provider, including the specific context and conditions of use, as specified in the information supplied by the provider in the instructions for use, promotional or sales materials and statements, as well as in the technical documentation",tech:IntendedUse,sc,,,AIA (Art. 3(12)),,2024-04-10,,Delaram Golpayegani,accepted,,,,,,,,,,,,,,,,
SubstantialModification,Substantial Modification,"A change to an AI system after its placing on the market or putting into service which is not foreseen or planned in the initial conformity assessment carried out by the provider and as a result of which the compliance of the AI system with the requirements set out in Chapter III, Section 2 is affected or results in a modification to the intended purpose for which the AI system has been assessed",,,,,AIA(Art. 3(23)),,2024-04-10,2025-07-30,Delaram Golpayegani,modified,,,,,,,,,,,,,,,,
other,,,,,,,,,,,,,,,,,,,,,,,,,,,,
PubliclyAccessibleSpace,Publicly Accessible Space,"Any publicly or privately owned physical place accessible to an undetermined number of natural persons, regardless of whether certain conditions for access may apply, and regardless of the potential capacity restrictions",dpv:PublicLocation,dpv:Location,,,AIA(Art. 3(44)),,2024-04-10,2025-07-30,Delaram Golpayegani,modified,,,,,,,,,,,,,,,,
LawEnforcement,Law Enforcement,"Activities carried out by law enforcement authorities or on their behalf for the prevention, investigation, detection or prosecution of criminal offences or the execution of criminal penalties, including the safeguarding against and the prevention of threats to public security.",,dpv:Sector,,,AIA(Art. 3(41)),,2024-04-10,,Delaram Golpayegani,duplicate,,,,,,,,,,,,,,,,
CriticalInfrastructure,Critical Infrastructure,"An asset, a facility, equipment, a network or a system, or a part of thereof, which is necessary for the provision of an essential service within the meaning of Article 2(4) of Directive (EU) 2022/2557",,dpv:Sector,,,AIA(Art. 3(44h)),,2024-04-10,,Delaram Golpayegani,duplicate,,,,,,,,,,,,,,,,
AILiteracy,AI Literacy,"Skills, knowledge and understanding that allow providers, deployers and affected persons, taking into account their respective rights and obligations in the context of this Regulation, to make an informed deployment of AI systems, as well as to gain awareness about the opportunities and risks of AI and possible harm it can cause",dpv:AILiteracy,dpv:OrganisationalMeasure,,,AIA (Art. 3(56)),"AI Literacy should take into account the subject's level of technical knowledge, experience, education and training -- these can be represented through the corresponding concepts in the PD extension",2024-04-10,2026-02-09,Delaram Golpayegani,modified,,,,,,,,,,,,,,,,
