Term,Label,Definition,ParentTerm,ParentType,Value,RelatedTerms,Relation,Usage,Source,Created,Modified,Status,Contributors,Resolution
Context,Context,Contextually relevant information,dpv:Concept,a,,,,"Context is a catch-all concept for information of relevance not possible to represent through other core concepts. DPV offers specific contextual concepts such as Necessity, Frequency, and Duration. More can be created by extending Context within use-cases.",,2019-04-05,2022-06-15,accepted,"Harshvardhan J. Pandit, Javier Fernández, Axel Polleres, Elmar Kiesling, Fajar Ekaputra, Simon Steyskal",https://www.w3.org/2019/04/05-dpvcg-minutes.html,,,,,,,,,,,,,,,
Importance,Importance,An indication of 'importance' within a context,dpv:Context,sc,,,,"Importance can be used to express importance, desirability, relevance, or significance as a context.",,2022-02-09,,accepted,"Harshvardhan J. Pandit, Paul Ryan, Georg P. Krog, Julian Flake, Beatriz Esteves",https://www.w3.org/2022/02/09-dpvcg-minutes.html,,,,,,,,,,,,,,,
PrimaryImportance,Primary Importance,Indication of 'primary' or 'main' or 'core' importance,,dpv:Importance,,,,,,2022-02-10,,accepted,"Harshvardhan J. Pandit, Paul Ryan, Georg P. Krog, Julian Flake, Beatriz Esteves",https://www.w3.org/2022/02/09-dpvcg-minutes.html,,,,,,,,,,,,,,,
SecondaryImportance,Secondary Importance,Indication of 'secondary' or 'minor' or 'auxiliary' importance,,dpv:Importance,,,,,,2022-02-11,,accepted,"Harshvardhan J. Pandit, Paul Ryan, Georg P. Krog, Julian Flake, Beatriz Esteves",https://www.w3.org/2022/02/09-dpvcg-minutes.html,,,,,,,,,,,,,,,
Necessity,Necessity,An indication of 'necessity' within a context,dpv:Context,sc,,,,"Necessity can be used to express need, essentiality, requirement, or compulsion.",,2022-02-12,,accepted,"Harshvardhan J. Pandit, Paul Ryan, Georg P. Krog, Julian Flake, Beatriz Esteves",https://www.w3.org/2022/02/09-dpvcg-minutes.html,,,,,,,,,,,,,,,
Required,Required,Indication of 'required' or 'necessary',,dpv:Necessity,,,,,,2022-02-13,,accepted,"Harshvardhan J. Pandit, Paul Ryan, Georg P. Krog, Julian Flake, Beatriz Esteves",https://www.w3.org/2022/02/09-dpvcg-minutes.html,,,,,,,,,,,,,,,
StatutoryRequirement,Statutory Requirement,Indication that the requirement arises from a statutory or legal obligation,dpv:Required,dpv:Necessity,,,,,,,,proposed,"Georg P. Krog, Harshvardhan J. Pandit",,,,,,,,,,,,,,
ContractualRequirement,Contractual Requirement,Indication that the requirement arises from a contractual obligation,dpv:Required,dpv:Necessity,,,,,,,,proposed,"Georg P. Krog, Harshvardhan J. Pandit",,,,,,,,,,,,,,
EnteringIntoContractRequirement,Entering into Contract Requirement,Indication that the requirement arises as a necessity to enter into a contract,dpv:Required,dpv:Necessity,,,,,,,,proposed,"Georg P. Krog, Harshvardhan J. Pandit",,,,,,,,,,,,,,
Optional,Optional,Indication of 'optional' or 'voluntary',,dpv:Necessity,,,,,,2022-02-14,,accepted,"Harshvardhan J. Pandit, Paul Ryan, Georg P. Krog, Julian Flake, Beatriz Esteves",https://www.w3.org/2022/02/09-dpvcg-minutes.html,,,,,,,,,,,,,,,
NotRequired,Not Required,Indication of neither being required nor optional i.e. not relevant or needed,,dpv:Necessity,,,,,,2022-02-15,,accepted,"Harshvardhan J. Pandit, Paul Ryan, Georg P. Krog, Julian Flake, Beatriz Esteves",https://www.w3.org/2022/02/09-dpvcg-minutes.html,,,,,,,,,,,,,,,
Scope,Scope,Indication of the extent or range or boundaries associated with(in) a context,dpv:Context,sc,,,,,,2022-06-15,,accepted,Harshvardhan J. Pandit,https://www.w3.org/2022/06/15-dpvcg-minutes.html,,,,,,,,,,,,,,,
Justification,Justification,"A form of documentation providing reasons, explanations, or justifications",dpv:Context,sc,,,,,,2022-06-15,,accepted,Harshvardhan J. Pandit,https://www.w3.org/2022/06/15-dpvcg-minutes.html,,,,,,,,,,,,,,,
Frequency,Frequency,The frequency or information about periods and repetitions in terms of recurrence.,dpv:Context,sc,,,,,,2022-02-16,,accepted,Harshvardhan J. Pandit,https://www.w3.org/2022/03/23-dpvcg-minutes.html,,,,,,,,,,,,,,,
ContinuousFrequency,Continuous Frequency,Frequency where occurrences are continuous,,dpv:Frequency,,,,,,2022-06-15,2020-10-05,accepted,Harshvardhan J. Pandit,https://www.w3.org/2022/06/15-dpvcg-minutes.html,,,,,,,,,,,,,,,
OftenFrequency,Often Frequency,"Frequency where occurrences are often or frequent, but not continuous",,dpv:Frequency,,,,,,2022-06-15,2020-10-05,accepted,Harshvardhan J. Pandit,https://www.w3.org/2022/06/15-dpvcg-minutes.html,,,,,,,,,,,,,,,
SporadicFrequency,Sporadic Frequency,Frequency where occurrences are sporadic or infrequent or sparse,,dpv:Frequency,,,,,,2022-06-15,2020-10-05,accepted,Harshvardhan J. Pandit,https://www.w3.org/2022/06/15-dpvcg-minutes.html,,,,,,,,,,,,,,,
SingularFrequency,Singular Frequency,Frequency where occurrences are singular i.e. they take place only once,,dpv:Frequency,,,,,,2022-06-15,2020-10-05,accepted,Harshvardhan J. Pandit,https://www.w3.org/2022/06/15-dpvcg-minutes.html,,,,,,,,,,,,,,,
Duration,Duration,The duration or temporal limitation,dpv:Context,sc,,,,,,2022-02-09,,accepted,Harshvardhan J. Pandit,https://www.w3.org/2022/03/23-dpvcg-minutes.html,,,,,,,,,,,,,,,
IndeterminateDuration,Indeterminate Duration,Duration that is indeterminate or cannot be determined,,dpv:Duration,,,,"Indeterminate means (exact or otherwise) information about the duration cannot be determined, which is distinct from 'EndlessDuration' where it is known (or decided) that the duration is open-ended or without an end. ",,2022-11-30,,accepted,Harshvardhan J. Pandit,,,,,,,,,,,,,,,,
EndlessDuration,Endless Duration,Duration that is (known or intended to be) open ended or without an end,,dpv:Duration,,,,,,2022-06-15,2020-10-05,accepted,Harshvardhan J. Pandit,https://www.w3.org/2022/06/15-dpvcg-minutes.html,,,,,,,,,,,,,,,
TemporalDuration,Temporal Duration,Duration that has a fixed temporal duration e.g. 6 months,dpv:Duration,sc,,,,,,2022-06-15,2020-10-05,accepted,Harshvardhan J. Pandit,https://www.w3.org/2022/06/15-dpvcg-minutes.html,,,,,,,,,,,,,,,
UntilEventDuration,Until Event Duration,Duration that takes place until a specific event occurs e.g. Account Closure,dpv:Duration,sc,,,,,,2022-06-15,2020-10-05,accepted,Harshvardhan J. Pandit,https://www.w3.org/2022/06/15-dpvcg-minutes.html,,,,,,,,,,,,,,,
UntilTimeDuration,Until Time Duration,Duration that has a fixed end date e.g. 2022-12-31,dpv:Duration,sc,,,,,,2022-06-15,2020-10-05,accepted,Harshvardhan J. Pandit,https://www.w3.org/2022/06/15-dpvcg-minutes.html,,,,,,,,,,,,,,,
FixedOccurrencesDuration,Fixed Occurrences Duration,Duration that takes place a fixed number of times e.g. 3 times,dpv:Duration,sc,,,,,,2022-06-15,2020-10-05,accepted,Harshvardhan J. Pandit,https://www.w3.org/2022/06/15-dpvcg-minutes.html,,,,,,,,,,,,,,,
PurposeDuration,Purpose Duration,The duration associated with fulfilment or carrying out purpose(s),dpv:Duration,sc,,,,,,,,proposed,"Harshvardhan J. Pandit, Piero Bonatti",,,,,,,,,,,,,,
ConsentDuration,Consent Duration,The duration associated with fulfilment or validity of consenting decision(s),dpv:Duration,sc,,,,,,,,proposed,"Harshvardhan J. Pandit, Piero Bonatti",,,,,,,,,,,,,,
ContractDuration,Contract Duration,The duration associated with fulfilment or carrying out contract(s),dpv:Duration,sc,,,,,,,,proposed,"Harshvardhan J. Pandit, Piero Bonatti",,,,,,,,,,,,,,
Occurrenace,Occurrence,The occurrence of something in terms of when it occurs or applies ,dpv:Context,sc,,,,Useful to signal whether some processing or purpose is applicable as an initial or subsequent context,,,,proposed,"Harshvardhan J. Pandit, Piero Bonatti",,,,,,,,,,,,,,
InitialOccurence,Initial Occurrence,Indication that the specified context has an initial occurrence or that it applies initially or at the beginning,dpv:Occurence,sc,,,,,,,,proposed,"Harshvardhan J. Pandit, Piero Bonatti",,,,,,,,,,,,,,
SubsequentOccurence,Subsequent Occurrence,Indication that the specified context has a subsequent occurrence or that it applies after the initial occurrence or not at the beginning,dpv:Occurence,sc,,,,,,,,proposed,"Harshvardhan J. Pandit, Piero Bonatti",,,,,,,,,,,,,,
Applicability,Applicability,"Concept provided to represent indication of cases where the information or context is not applicable (N/A) or not available or this is not known or determined yet. If the information is applicable and available, this concept should not be used.",dpv:Context,sc,,,,"These concepts are useful in closed-world interpretations, for example in forms where a field must have a value to explicitly denote it is not applicable or the information is not available yet. ",,2023-08-24,,accepted,Harshvardhan J. Pandit,,,,,,,,,,,,,,,,
UnknownApplicability,Unknown Applicability,Concept indicating information or context availability is unknown i.e. it is not known if the information exists or is applicable and therefore statements about its availability cannot be made (yet),dpv:Applicability,a,,,,"This concept is useful when describing situations where it cannot be stated whether the context applies or whether the information is not available yet. For example, if a form field asks about whether a process X was completed and it is not yet known whether X applies or not and therefore it is also unclear whether X was completed or not. Using UnknownApplicability is a signal that the applicability of X should be assessed, and if applicable, then information about X should be identified and used here.",,2023-08-24,,accepted,Harshvardhan J. Pandit,,,,,,,,,,,,,,,,
NotApplicable,Not Applicable,Concept indicating the information or context is not applicable,dpv:Applicability,a,,,,This relates to a 'Stop' state as distinct from a 'Halt' state. It makes no comments on whether the Activity can be resumed or continued towards completion.,,2023-08-24,,accepted,Harshvardhan J. Pandit,,,,,,,,,,,,,,,,
NotAvailable,Not Available,Concept indicating the information or context is applicable but information is not yet available,dpv:Applicability,a,,,,"This concept is useful when describing situations where information is required but is not available (yet). For example, if in a form a field asks about whether a process X was completed, and it is correct to interpret that process X is applicable and must be completed, but the information is not yet available as to whether this was done - then NotAvailable is useful to represent this.",,2023-08-24,,accepted,Harshvardhan J. Pandit,,,,,,,,,,,,,,,,
FeeRequirement,Fee Requirement,Concept indicating whether a fee is required,dpv:Context,sc,,,,,,2024-08-27,,accepted,"Harshvardhan J. Pandit, Georg P. Krog",
FeeRequired,Fee Required,Concept indicating a fee is required. The value of the fee should be specified using rdf:value or an another relevant means,dpv:FeeRequirement,sc,,,,,,2024-08-27,,accepted,"Harshvardhan J. Pandit, Georg P. Krog",
FeeNotRequired,Fee Not Required,Concept indicating a fee is not required. This is distinct from a Fee of zero as it indicates a fee is not applicable in the context,dpv:FeeRequirement,a,,,,,,2024-08-27,,accepted,"Harshvardhan J. Pandit, Georg P. Krog",
ReuseCompatibility,ReuseCompatibility,Concept indicating whether the specified context is compatible with another earlier context,dpv:Context,sc,,,,"Compatibility refers to whether two contexts, such as dpv:Process instances, are compatible with each other based on a criteria which is not defined by the concept. This criteria can be based on requirements from law, such as GDPR's purpose compatibility or can be based on privacy norms such as contextual integrity. To express such interpretations, further concepts should be expanded from this base concept",,2025-06-19,,accepted,"Harshvardhan J. Pandit, Georg P. Krog, Beatriz Esteves, Delaram Golpayegani, Julian Flake, Arthit Suriyawongkul",
PrimaryUse,Primary Use,Concept indicating compatibility based on the use being either the original context or something that is compatible with it,,dpv:ReuseCompatibility,,,,"Primary Use refers to an assessment where two contexts are found to be compatible, e.g. if purpose is used to test compatibility, then for two activities the second activity is said be the primary use if its purpose is compatible with the first activity's purpose",,2025-06-19,,accepted,"Harshvardhan J. Pandit, Georg P. Krog, Beatriz Esteves, Delaram Golpayegani, Julian Flake, Arthit Suriyawongkul",
SecondaryUse,Secondary Use,Concept indicating incompatibility based on the use not being compatible with an earlier context,,dpv:ReuseCompatibility,,,,"Secondary Use refers to an assessment where two contexts are found to be incompatible, e.g. if purpose is used to test compatibility, then for two activities the second activity is said be the secondary use if its purpose is incompatible with the first activity's purpose",,2025-06-19,,accepted,"Harshvardhan J. Pandit, Georg P. Krog, Beatriz Esteves, Delaram Golpayegani, Julian Flake, Arthit Suriyawongkul",
PrimaryInitialUse,Primary Initial Use,Concept indicating this is the first or initial context which will be used for comparing compatibility with,dpv:PrimaryUse,dpv:ReuseCompatibility,,,,Primary Initial Use is useful to indicate this is the original or initial context which will be used as the measure to compare with for compatibility assessments,,2025-06-19,,proposed,"Harshvardhan J. Pandit, Georg P. Krog, Beatriz Esteves, Delaram Golpayegani, Julian Flake, Arthit Suriyawongkul",
PrimarySubsequentReuse,Primary Subsequent Reuse,Concept indicating this is a compatible reuse with a prior initial context,dpv:PrimaryUse,dpv:ReuseCompatibility,,,,Primary Subsequent Reuse indicates that this is not the original or initial context but another context which is compatible with it,,2025-06-19,,proposed,"Harshvardhan J. Pandit, Georg P. Krog, Beatriz Esteves, Delaram Golpayegani, Julian Flake, Arthit Suriyawongkul",
SecondaryContextualReuse,Secondary Contextual Reuse,Concept indicating incompatibility based on the use not being compatible with an earlier context but still being within the same broader context i.e. the degree of incompability does not violate or go beyond some established parameters or norms,dpv:SecondaryUse,dpv:ReuseCompatibility,,,,"Secondary Contextual Reuse is useful to indicate that even if the context is incompatible, the degree of incompatibility does not go beyond an established norm. For example, in healthcare settings, reusing data from patients for medical research is considered secondary use, however, it still occurs within the aegis and duties of the hospital and therefore is different from cases where another external for-profit company is reusing the data (which is represented as Tertiary Use)",,2025-06-19,,proposed,"Harshvardhan J. Pandit, Georg P. Krog, Beatriz Esteves, Delaram Golpayegani, Julian Flake, Arthit Suriyawongkul",
TertiaryUse,Tertiary Use,Concept indicating incompatibility that goes beyond some established parameters or norms to the extent that it is considered tertiary or completely removed or detached from the initial primary use,dpv:SecondaryUse,dpv:ReuseCompatibility,,,,"Tertiary Use is useful to indicate that the incompatibility is to such a degree that it should not be considered mere secondary use of the data and should be further distinguished from it. For example, in healthcare, reusing data from patients for medical research is considered secondary use, but if the same data is being used by external third parties who have no relation to the patients and are not using it for public good, then it can be considered as a Tertiary Use. This concept is intended to be analogous to ""Third Party"" in privacy contexts",,2025-06-19,,proposed,"Harshvardhan J. Pandit, Georg P. Krog, Beatriz Esteves, Delaram Golpayegani, Julian Flake, Arthit Suriyawongkul",
CompatibilityUnknown,Compatibility Unknown,Concept indicating the compatibility of the context with an earlier context is currently unknown,,dpv:ReuseCompatibility,,,,,,2025-06-19,,accepted,"Harshvardhan J. Pandit, Georg P. Krog, Beatriz Esteves, Delaram Golpayegani, Julian Flake, Arthit Suriyawongkul",
