Term,Label,Definition,ParentTerm,ParentType,Value,RelatedTerms,Relation,Usage,Source,Created,Modified,Status,Contributors,Resolution,,,,,,,,,,,,,,,
ElectronicHealthDataAccessService,Electronic Health Data Access Service,"Technical service, such as an online portal or application, that allows data subjects to access their electronic health data or the electronic health data of those natural persons whose electronic health data they are legally authorised to access",sector-health:ElectronicHealthDataAccessService,dpv:Technology,,,,,EHDS Art.2.2(h),2025-10-28,,accepted,Beatriz Esteves,,,,,,,,,,,,,,,,
HealthProfessionalAccessService,Health Professional Access Service,"Technical service, supported by an EHR system, that enables health professionals to access data of natural persons under their care",sector-health:HealthProfessionalAccessService,dpv:Technology,,,,,EHDS Art.2.2(h),2025-10-28,,accepted,Beatriz Esteves,,,,,,,,,,,,,,,,
EHRSystem,Electronic Health Record System,"A system whereby the software and/or hardware allows personal electronic health data to be collected and processed, to be used by healthcare providers when providing patient care or by patients when accessing their electronic health data",sector-health:EHRSystem,dpv:Technology,,,,,EHDS Art.2.2(i),2025-10-28,,accepted,Beatriz Esteves,,,,,,,,,,,,,,,,
InteroperabilitySoftwareForEHRSystem,Interoperability Software for EHR System,Software component of the EHR system which provides and receives personal electronic health data under a priority category for primary use established under the EHDS Regulation in the European electronic health record exchange format,sector-health:InteroperabilitySoftwareForEHRSystem,dpv:Technology,,,,,EHDS Art.2.2(n),2025-10-28,,accepted,Beatriz Esteves,,,,,,,,,,,,,,,,
LoggingSoftwareForEHRSystem,Logging Software for EHR System,Software component of the EHR system which provides logging information related to access by health professionals or other individuals to priority categories of personal electronic health data,sector-health:LoggingSoftwareForEHRSystem,dpv:Technology,,,,,EHDS Art.2.2(o),2025-10-28,,accepted,Beatriz Esteves,,,,,,,,,,,,,,,,
WellnessApplication,Wellness Application,"Software component for the processing of electronic health data, specifically for providing information on the health of natural persons, or the delivery of care for purposes other than the provision of healthcare",sector-health:WellnessApplication,dpv:Technology,,,,,EHDS Art.2.2(ab),2025-10-28,,accepted,Beatriz Esteves,,,,,,,,,,,,,,,,
