Status,Notes,Term (ignore),Term,Label (de),Label (en),Definition (de),Definition (en),ParentType,ParentTerm,Source,Contributors,Created,
accepted,,DatenhaltendeStelle,HealthDataHolder,Datenhaltende Stelle,Health Data Holder,"Natürliche oder juristische Personen, die berechtigt oder verpflichtet sind, Gesundheitsdaten für Forschungszwecke zu verarbeiten",Natural or legal person that is authorised or obligated to process health data for research purposes,,sector-health:HealthDataHolder,[[GDNG]] § 2(3),Julian Flake,2025-10-13,
accepted,,Datenplattform,DataPlatform,Datenplattform,Data Platform,Zusammenschlüsse von datenhaltenden Stellen zu Datenplattformen,Networks of health data holders forming data platforms,sc,de-gdng:HealthDataHolder,[[GDNG]] § 2,"Julian Flake, Christian Draeger",2025-10-13,
accepted,,Dateninfrastruktur,DataInfrastructure,Dateninfrastruktur,Data Infrastructure,Zusammenschlüsse von datenhaltenden Stellen zu Dateninfrastrukturen,Networks of health data holders forming data infrastructures,sc,de-gdng:HealthDataHolder,[[GDNG]] § 2,"Julian Flake, Christian Draeger",2025-10-13,
accepted,,GesetzlichGeregelteDatenhaltendeStelle,RegulatedHealthDataHolder,Gesetzlich geregelte datenhaltende Stelle,Regulated Health Data Holder,"Solche datenhaltenden Stellen, die gesetzlich geregelt sind, wie das Forschungsdatenzentrum Gesundheit, das Zentrum für Krebregisterdaten beim RKI und die Plattform nach §64e Abs.9 des fünften Buches Sozialgesetzbuch","Data holders regulated by law. Examples are the German ""Health Data Lab"", the ""German Centre for Cancer Registry Data"" and the ""Model Project Genome Sequencing""",sc,de-gdng:HealthDataHolder,[[GDNG]] § 2(3),Julian Flake,2025-10-13,
accepted,,ForschungsdatenzentrumGesundheit,HealthDataLab,Forschungsdatenzentrum Gesundheit,Health Data Lab,Forschungsdatenzentrum Gesundheit nach § 303d des Fünften Buches Sozialgesetzbuch,Health Data Lab pursuant to § 303d of Fünftes Buch Sozialgesetzbuch,a,de-gdng:RegulatedHealthDataHolder,[[GDNG]] § 2,"Julian Flake, Christian Draeger",2025-10-13,
accepted,,ZentrumFuerKrebsregisterdaten,GermanCentreForCancerRegistryData,Zentrum für Krebsregisterdaten beim Robert-Koch-Institut,German Centre for Cancer Registry Data,Zentrum für Krebsregisterdaten nach § 1 Bundeskrebsregisterdaten­gesetz,German Centre for Cancer Registry Data pursuant § 1 Bundeskrebsregisterdatengesetz,a,de-gdng:RegulatedHealthDataHolder,[[GDNG]] § 2,"Julian Flake, Christian Draeger",2025-10-13,
accepted,,PlattformModellvorhabenGenomsequenzierung,ModelProjectGenomeSequencingPlatform,Plattform des Modellvorhabens Genomsequenzierung,Model Project Genome Sequencing Platform,"Plattform nach § 64e Modellvorhaben zur umfassenden Diagnostik und Therapiefindung mittels Genomsequenzierung bei seltenen und bei onkologischen Erkrankungen, Verordnungsermächtigung des Fünften Buches Sozialgesetzbuch",Model Project Platform pursuant to § 64e of Fünften Buches Sozialgesetzbuch,a,de-gdng:RegulatedHealthDataHolder,[[GDNG]] § 2,"Julian Flake, Christian Draeger",2025-10-13,
accepted,,Datennutzende,HealthDataUser,Datennutzende,Health Data User,"Natürliche und juristische Personen, die Zugang zu Gesundheitsdaten zu Forschungszwecken und weiteren Zwecken begehren oder erhalten haben",Natural or legal person that is requesting or entitled to process health data for research purposes,,sector-health:HealthDataUser,[[GDNG]] § 2,Julian Flake,2025-10-13,
accepted,,DatenverarbeitendeGesundheitseinrichtung,DataProcessingHealthcareFacility,Datenverarbeitende Gesundheitseinrichtung,Data Processing Healthcare Facility,"Einrichtung, in der für Zwecke der Gesundheitsvorsorge oder der Arbeitsmedizin, für die Beurteilung der Arbeitsfähigkeit des Beschäftigten, für die medizinische Diagnostik oder für Zwecke der Versorgung oder Behandlung im Gesundheits- oder Sozialbereich Daten von oder unter der Verantwortung von Angehörigen eines Heilberufs verarbeitet werden, der für die Berufsausübung oder die Führung der Berufsbezeichnung eine staatlich geregelte Ausbildung erfordert","Institution which process data for the purposes of preventative or occupational medicine, for the assessment of the employee's capacity to work, for medical diagnosis, or for the purposes of care or treatment in the health or social sector under the responsibility of members of a health profession, where such a profession requires state-regulated training for the exercise of the profession or the use of the professional title",,dpv:Organisation,[[GDNG]] § 2,"Julian Flake, Christian Draeger",2025-10-13,
accepted,,DatenzugangsUndKoordinierungsStelle,DataAccessAndCoordinationOffice,Datenzugangs- und Koordinierungsstelle für Gesundheitsdaten (DACO),Data Access and Coordination Office (DACO),"Datenzugangs- und Koordinierungsstelle für Gesundheitsdaten (DACO), angesiedelt beim Bundesinstitut für Arzneimittel und Medizinprodukte (BfArM)","Data Access and Coordination Office for Health Data (DACO), based at the Federal Institute for Drugs and Medical Devices (BfArM)",a,dpv:Authority,[[GDNG]] § 3(1),Julian Flake,2025-10-13,
accepted,,ZustaendigeDatenhaltendeUndMittelndeStelle,ResponsibleDataHoldingAndMediatingBody,Zuständige datenhaltende und mittelnde Stelle,Responsible Data-holding and Mediating Body,"Diejenige datenhaltende und -mittelnde Stelle, die für ein konkretes Forschungsvorhaben zuständig ist",Data holding and mediating body responsible for a specific research project,sc,de-gdng:HealthDataHolder,[[GDNG]] § 3(2) point 4,"Julian Flake, Christian Draeger",2025-10-13,
accepted,Definitionen fehlen,Dritte,ThirdParty,Dritte,Third Party,,,,dpv:ThirdParty,[[GDNG]] § 6(3),"Julian Flake, Christian Draeger",2026-02-10,
accepted,Definitionen fehlen,betroffenePerson,DataSubject,Betroffene Person,Data Subject,,,,eu-gdpr:DataSubject,[[GDNG]] § 6(3),"Julian Flake, Christian Draeger",2026-02-08,
accepted,Definitionen fehlen,Verantwortliche,Controller,Datenschutzrechtlich verantwortliche Stelle,Controller,,,,eu-gdpr:Controller,[[GDNG]] § 6(3),"Julian Flake, Christian Draeger",2026-02-08,
accepted,,KrebsregisterDerLaender,FederalStateCentresForCancerRegistryData,klinische Krebsregister der Länder,Federal State Centres for Cancer Registry Data,Die klinischen Krebsregister der Länder nach § 65c des Fünften Buches Sozialgesetzbuch,The federal state centres for cancer registry data pursuant to § 65c des Fünften Buches Sozialgesetzbuch,sc,de-gdng:HealthDataHolder,[[GDNG]] § 3(2) point 10,Julian Flake,2025-10-13,
accepted,,BefugtePerson,AuthorizedPerson,Befugte Person,Authorized Person,Eine natürliche Person die nach einem Rechte- und Rollenkonzept die Weiterverarbeitung von Gesundheitsdaten nach der Rechtsgrundlage § 6(1) GDNG an einer Gesundheitseinrichtung durchführt,"A natural person that, according to a rights and rolls concept, proccesses healtcare data at a healthcare facility pursuant to the legal basis of § 6(1) GDNG",,dpv:LegalEntity,[[GDNG]] § 6(1),Julian Flake,2025-10-13,
accepted,Kann Verbund auch Organisation sein?,,PublicJointHealthResearchNetwork,Öffentlich geförderte Zusammenschlüsse von datenverarbeitenden Gesundheitseinrichtungen,Publicly Funded Networks of Data Processing Healthcare Facilitys,"Öffentlich geförderte Zusammenschlüsse von datenverarbeitenden Gesundheitseinrichtungen einschließlich Verbundforschungsvorhaben und Forschungspraxennetzwerken, die nach § 6(1) GDNG Gesundheitsdaten gemeinsam nutzen und verarbeiten","Publicly funded networks of data processing healthcare facilitys, including joint research projects and research practice networks, which jointly use and process health data pursuant to § 6(1) GDNG",,dpv:LegalEntity,[[GDNG]] § 6(3),"Julian Flake, Christian Draeger",2025-10-13,
proposed,Definitionen fehlen,,JointResearchProject,Verbundforschungsvorhaben,Joint Research Project,,,,de-gdng:JointPublicHealthResearch,[[GDNG]] § 6(3),"Julian Flake, Christian Draeger",2025-10-13,
proposed,Definitionen fehlen,,ResearchPracticeNetwork,Forschungspraxennetzwerken,Research Practice Network,,,,de-gdng:JointPublicHealthResearch,[[GDNG]] § 6(3),"Julian Flake, Christian Draeger",2025-10-13,
proposed,use case / description missing,AKGesundheitsDatenNutzung,WorkingGroupOnHealthDataUse,Arbeitskreis zur Gesundheitsdatennutzung,Working Group on Health Data Use,Ein von der DACO im Benehmen mit dem BMG und dem BMBF eingerichteter Arbeitskreis zur Gesundheitsdatennutzung.,Working group on health data use established by the DACO in consultation with BMG and BMBF.,a,dpv:GovernmentalOrganisation,,Julian Flake,2025-10-13,
proposed,source missing,Forschungseinrichtung,ResearchInstitute,Forschungseinrichtung,Research Institute,"Forschungsinstitut, das mit Gesundheitsdaten forschen möchte oder forscht.",Research institute that wants to perfom or performs research with health data.,,dpv:HealthDataUser,,Julian Flake,2026-02-05,
rejected,not a gdng specific actor,BfArM,BfArM,Bundesinstitut für Arzneimittel und Medizinprodukte (BfArM),Federal Institute for Drugs and Medical Devices (BfArM),Das Bundesinstitut für Arzneimittel und Medizinprodukte (BfArM).,Federal Institute for Drugs and Medical Devices (BfArM).,a,dpv:GovernmentalOrganisation,[[GDNG]] § 3(1),Julian Flake,2025-10-13,
rejected,not a gdng specific actor,BMG,BMG,Bundesministerium für Gesundheit (BMG),Federal Ministry of Health (BMG),,,a,dpv:GovernmentalOrganisation,[[GDNG]] § 3(3),Julian Flake,2025-10-13,
rejected,not a gdng specific actor,BMBF,BMBF,Bundesministerium für Bildung und Forschung (BMBF),Federal MInistry of Education and Health (BMBF),,,a,dpv:GovernmentalOrganisation,[[GDNG]] § 3(3),Julian Flake,2025-10-13,
rejected,not a gdng specific actor,BMAS,BMAS,Bundesministerium für Arbeit und Soziales (BMAS),Federal Ministry of Labour and Social Affairs (BMAS),,,a,dpv:GovernmentalOrganisation,[[GDNG]] § 3(3),Julian Flake,2025-10-13,
rejected,not a gdng specific actor,,,Bundesrat,,,,a,dpv:GovernmentalOrganisation,[[GDNG]] § 3(3),Julian Flake,2025-10-13,
proposed,Parent von DataProcessingHealthcareFacility?,Gesundheitseinrichtung / Leistungserbringer / Term in sector-health?,,,,,,,,,,,
