Status,Notes,Term (ignore),Term,Label (de),Label (en),Definition (de),Definition (en),ParentType,ParentTerm,Source,Contributors,Created,EHDS (de),EHDS (en)
accepted,,OeffentlicherMetadatenKatalog,PublicMetadataCatalogue,Öffentlicher Metadaten-Katalog,Public metadata catalogue,"Von der DACO barrierefrei zu führender und pflegender Katalog, in dem zu Transparenzzwecken Informationen über die im deutschen Gesundheitswesen vorhandenen und öffentlich zugänglichen Gesundheitsdaten und über die jeweiligen Halter dieser Daten gesammelt werden.","An accessible catalog, driven and maintained by the DACO, in which information about existing and publicly available health data along with the respective data holder are collected to fulfill transparency obligations.",sc,tech:DataStorage,[[GDNG]] A.1 § 3 Abs. 2 Nr. 1,Julian Flake,2025-10-13,,
accepted,process and/or document: should become two separate concepts,GesundheitsdatenAnfrage,HealthDataQuery,Identifizierung und Lokalisierung von Gesundheitsdaten,Indentification and localization of health data,"Ein Vorgang, bei dem Datennutzende von der DACO beraten werden. Dieser Term kann sowohl für einen Antragsprozess als auch für das Datenartefakt der Rechercheanfrage (vergleichbar mit einem Formular) verwendet werden.",This term can be used to describe a process of application as well as the actual data artifact of the application (comparable to a form).,sc,dpv:Data,[[GDNG]] A.1 § 3 Abs. 2 Nr. 2,"Julian Flake, Christian Henke, Matthias Löbe, Christian Draeger",2025-10-13,,
proposed,sperrig,,HealthDataQueryProcess,,,,,sc,dpv:Process,,,,,
accepted,"process and/or document: should become two separate concepts;
once access is permitted, should we add DataPermit (analogously to EHDS?)",GesundheitsdatenZugangsAntrag,HealthDataAccessApplication,Antrag auf Zugang zu Gesundheitsdaten,Health data access application,Antrag auf Zugang von Datennutzenden auf Zugang zu Gesundheitsdaten bei datenhaltenden Stellen. Die DACO berät Datennutzende bei diesem Vorgang. Dieser Term kann sowohl für einen Antragsprozess als auch für das Datenartefakt des Antrags (vergleichbar mit einem Formular) verwendet werden.,This term can be used to describe a process of application as well as the actual data artifact of the application (comparable to a form).,sc,dpv:Data,[[GDNG]] A.1 § 3 Abs. 2 Nr. 3,Julian Flake,2025-10-13,Antrag auf Zugang zu Gesundheitsdaten,eu-ehds:DataAccessApplication
proposed,sperrig,,HealthDataAccessApplicationProcess,,,,,sc,dpv:Process,,,,,
accepted,,OeffentlichesAntragsregister,PublicHealthDataAccessApplicationRegister,Öffentliches Antragsregister,Public health data access application register,"Von der DACO gepflegtes, öffentliches Register mit Informationen zu den über die DACO gestellten Anträgen auf Zugang zu Gesundheitsdaten, zu den Datennutzenden, zu den Vorhaben, für die Daten beantragt wurden, und zu deren Ergebnissen.","A public registry of information about health data access applications, the corresponding data users, research projects and requested data, maintained by the DACO.",sc,tech:DataStorage,[[GDNG]] A.1 § 3 Abs. 2 Nr.7,Julian Flake,2025-10-13,,
accepted,,SichereVerarbeitungsUmgebung,SecureProcessingEnvironment,Sichere Verarbeitungsumgebung,Secure processing environment,Durch die DACO konzeptionierte Maßnahme zur Verbesserung des Datenschutzes und der Datensicherheit im Rahmen der Weiterverarbeitung von Gesundheitsdaten zu Forschungszwecken und weiteren im Gemeinwohl liegenden Zwecken.,"A measure for improvement of data protection and information security in context of processing of health data for research purposes and common welfare, drafted by the DACO.",sc,tech:OperatingEnvironment,[[GDNG]] A.1 § 3 Abs. 2 Nr. 9,Julian Flake,2025-10-13,Sichere Verarbeitungsumgebung,Secure processing environment
