Term,Label,Definition,ParentTerm,ParentType,RelatedTerms,Relation,Source,Usage,Created,Contributors,Status,,,,,,,,,,,,,,,,,,
ProportionalityAssessment,Proportionality Assessment,"Proportionality is a general principle of EU law, which when applied for the GDPR requires striking a balance between the processing of personal data and the resulting impacts on rights. More simply, the processing should not result in a disproportionate impact on rights",dpv:ImpactAssessment,dpv:OrganisationalMeasure,,,,The assessment of proportionality requires an assessment of necessity (represented by `eu-gdpr:NecessityAssessment`) and a balancing test (represented by `eu-gdpr:BalancingTest`). The outcome of the proportionality assessment is represented through the `eu-gdpr:ProportionalityStatus` instances,2025-10-10,"Stratis Koulierakis, Georg P. Krog, Harshvardhan J. Pandit",accepted,,,,,,,,,,,,,,,,,,
NecessityAssessment,Necessity Assessment,"An assessment of whether the processing of personal data is necessary to achieve the stated aims, where necessary indicates a lack of other means which could have been used instead",dpv:Assessment,dpv:OrganisationalMeasure,,,,,2025-10-10,"Stratis Koulierakis, Georg P. Krog, Harshvardhan J. Pandit",accepted,,,,,,,,,,,,,,,,,,
BalancingTest,Balancing Test,An assessment of whether the individual's interests override the interests of the controller,dpv:Assessment,dpv:OrganisationalMeasure,,,,,2025-10-10,"Stratis Koulierakis, Georg P. Krog, Harshvardhan J. Pandit",accepted,,,,,,,,,,,,,,,,,,
ProportionalityStatus,Proportionality Status,Status indicating whether the specific activity or context is proportionate,,dpv:Status,,,,,2025-10-10,"Stratis Koulierakis, Georg P. Krog, Harshvardhan J. Pandit",accepted,,,,,,,,,,,,,,,,,,
Proportionate,Proportionate,Status representing the activity or context is proportionate,,eu-gdpr:ProportionalityStatus,,,,,2025-10-10,"Stratis Koulierakis, Georg P. Krog, Harshvardhan J. Pandit",accepted,,,,,,,,,,,,,,,,,,
Disproportionate,Disproportionate,Status representing the activity or context is disproportionate i.e. it is not proportionate,,eu-gdpr:ProportionalityStatus,,,,,2025-10-10,"Stratis Koulierakis, Georg P. Krog, Harshvardhan J. Pandit",accepted,,,,,,,,,,,,,,,,,,
