Term,Label,Definition,ParentTerm,ParentType,Value,RelatedTerms,Relation,Usage,Source,Created,Modified,Status,Contributors,Resolution
Specific instances of technologies,Specific instances of technologies,,,,,,,,,,,,,
Database,Database,"A database, database management system (DBMS), or application database",tech:DataStorageTechnology,dpv:Technology,,,,,,2022-06-15,,accepted,Harshvardhan J. Pandit,https://www.w3.org/2022/06/15-dpvcg-minutes.html,,,,,,,,,,,,,,,
Cookie,Cookie,A HTTP or web or internet cookie,tech:LocalStorage,dpv:Technology,,,,,,2022-06-15,,accepted,Harshvardhan J. Pandit,https://www.w3.org/2022/06/15-dpvcg-minutes.html,,,,,,,,,,,,,,,
FileSystem,File System,A data storage and retrieval interface provided by an operating system,tech:DataStorageTechnology,dpv:Technology,,,,,,2022-06-15,,accepted,Harshvardhan J. Pandit,https://www.w3.org/2022/06/15-dpvcg-minutes.html,,,,,,,,,,,,,,,
SmartphoneApplication,Smartphone Application,A computing or digital program on a smartphone device,tech:Application,dpv:Technology,,,,,,2022-06-15,,accepted,Harshvardhan J. Pandit,https://www.w3.org/2022/06/15-dpvcg-minutes.html,,,,,,,,,,,,,,,
PersonalInformationManagementSystem,Personal Information Management System,"A PIMS is a system that helps to give individuals more control over their personal data by managing their personal data in secure, on-premises or online storage systems and sharing it when and with whomever they choose",tech:DataManagementTechnology,dpv:Technology,,,,,,2022-06-15,,accepted,Harshvardhan J. Pandit,https://www.w3.org/2022/06/15-dpvcg-minutes.html,,,,,,,,,,,,,,,
IdentityManagementTechnology,Identity Management Technology,"Technologies providing identity provision, verification, management, and governance","tech:IdentityTechnology,tech:ManagementTechnology",dpv:Technology,,,,,,2022-06-15,,accepted,Harshvardhan J. Pandit,https://www.w3.org/2022/06/15-dpvcg-minutes.html,,,,,,,,,,,,,,,
IdentityWallet,Identity Wallet,"product and service that allows the user to store identity data, credentials and attributes linked to her/his identity, to provide them to relying parties on request and to use them for authentication, online and offline, and to create qualified electronic signatures and seals ","tech:IdentityManagementTechnology,tech:DataStorageTechnology",dpv:Technology,,,,,,2022-06-15,,accepted,Harshvardhan J. Pandit,https://www.w3.org/2022/06/15-dpvcg-minutes.html,,,,,,,,,,,,,,,
