"term","type","iri","label","definition","dpvtype","subclassof","hasbroader","scopenote","created","modified","vocab","namespace"
"API","class","https://w3id.org/dpv/tech#API","API","A set of rules and protocols to communicate and exchange data between applications","https://w3id.org/dpv#Technology","","https://w3id.org/dpv/tech#Algorithm","","2024-12-01","","tech","https://w3id.org/dpv/tech"
"Action","class","https://w3id.org/dpv/tech#Action","Action","A process or activity, which could be physical or virtual","","https://w3id.org/dpv/tech#InputOutput","https://w3id.org/dpv/tech#InputOutput","Action is a concept referring to activities or tasks in the context of technologies producing or using them as inputs or outputs","2024-12-01","","tech","https://w3id.org/dpv/tech"
"Actor","class","https://w3id.org/dpv/tech#Actor","Actor","Actors and Entities involved in provision, use, and management of Technology","","https://w3id.org/dpv#Entity","https://w3id.org/dpv#Entity","","2022-06-15","","tech","https://w3id.org/dpv/tech"
"Algorithm","class","https://w3id.org/dpv/tech#Algorithm","Algorithm","A step-by-step set of instructions used to solve a problem or perform a computation","https://w3id.org/dpv#Technology","","https://w3id.org/dpv#Technology","","2024-12-01","","tech","https://w3id.org/dpv/tech"
"Android","class","https://w3id.org/dpv/tech#Android","Android","Android operating system","https://w3id.org/dpv#Technology","","https://w3id.org/dpv/tech#OS","","2022-06-15","","tech","https://w3id.org/dpv/tech"
"AppStore","class","https://w3id.org/dpv/tech#AppStore","Application Store","An application or platform for distribution of other applications","https://w3id.org/dpv#Technology","","https://w3id.org/dpv/tech#Application","","2022-06-15","","tech","https://w3id.org/dpv/tech"
"Application","class","https://w3id.org/dpv/tech#Application","Application","Application or Application Software","https://w3id.org/dpv#Technology","","https://w3id.org/dpv/tech#Software","","2022-06-15","","tech","https://w3id.org/dpv/tech"
"ApplicationSpecificIntegratedCircuit","class","https://w3id.org/dpv/tech#ApplicationSpecificIntegratedCircuit","ApplicationSpecificIntegratedCircuit","A custom-designed integrated circuit optimised for a specific task","https://w3id.org/dpv#Technology","","https://w3id.org/dpv/tech#IntegratedCircuit","","2024-12-01","","tech","https://w3id.org/dpv/tech"
"AudioContent","class","https://w3id.org/dpv/tech#AudioContent","Audio Content","Content that is or has an audio component","","https://w3id.org/dpv/tech#Content","https://w3id.org/dpv/tech#Content","","2024-12-01","","tech","https://w3id.org/dpv/tech"
"Auditor","class","https://w3id.org/dpv/tech#Auditor","Auditor","Actor that audits Technology for conformance to policies, standards, or legal requirements","https://w3id.org/dpv/tech#Actor","","https://w3id.org/dpv/tech#Partner","","2024-05-09","","tech","https://w3id.org/dpv/tech"
"Bluetooth","class","https://w3id.org/dpv/tech#Bluetooth","Bluetooth","Technology utilising bluetooth","https://w3id.org/dpv/tech#CommunicationMechanism","","https://w3id.org/dpv/tech#Networking","","2024-05-09","","tech","https://w3id.org/dpv/tech"
"Capability","class","https://w3id.org/dpv/tech#Capability","Capability","Expression of what the technology is capable of achieving or providing","","","","Examples of capabilities are image recognition, sentiment analysis, machine translation","2024-05-09","","tech","https://w3id.org/dpv/tech"
"CellularNetwork","class","https://w3id.org/dpv/tech#CellularNetwork","Cellular Network","Technology utilising cellular networking","https://w3id.org/dpv/tech#CommunicationMechanism","","https://w3id.org/dpv/tech#Networking","","2024-05-09","","tech","https://w3id.org/dpv/tech"
"CloudService","class","https://w3id.org/dpv/tech#CloudService","Cloud Service Provision","A remotely accessible service delivered over the internet for providing resources, software, or infrastructure","https://w3id.org/dpv#Technology","","https://w3id.org/dpv#Technology","","2024-12-01","","tech","https://w3id.org/dpv/tech"
"CloudStorage","class","https://w3id.org/dpv/tech#CloudStorage","Cloud Storage","Storage utilising cloud technologies","https://w3id.org/dpv#Technology","","https://w3id.org/dpv/tech#DataStorage","","2022-06-15","","tech","https://w3id.org/dpv/tech"
"CommunicationMechanism","class","https://w3id.org/dpv/tech#CommunicationMechanism","Communication Mechanism","Communication mechanism used or provided by Technology","","https://w3id.org/dpv#Technology","https://w3id.org/dpv#Technology","","2022-06-15","","tech","https://w3id.org/dpv/tech"
"Component","class","https://w3id.org/dpv/tech#Component","Component","A self-contained part of a system that performs a specific function and interacts with other components","https://w3id.org/dpv#Technology","","https://w3id.org/dpv#Technology","","2024-12-01","","tech","https://w3id.org/dpv/tech"
"Content","class","https://w3id.org/dpv/tech#Content","Content","Data or information in a particular form and structure","","https://w3id.org/dpv#Data;https://w3id.org/dpv/tech#InputOutput","https://w3id.org/dpv#Data;https://w3id.org/dpv/tech#InputOutput","Content is a concept referring to information used in the context of technologies producing or using them as inputs or outputs","2024-12-01","","tech","https://w3id.org/dpv/tech"
"Cookie","class","https://w3id.org/dpv/tech#Cookie","Cookie","A HTTP or web or internet cookie","https://w3id.org/dpv#Technology","","https://w3id.org/dpv/tech#LocalStorage","","2022-06-15","","tech","https://w3id.org/dpv/tech"
"Customer","class","https://w3id.org/dpv/tech#Customer","Customer","Actor that uses Technology directly or indirectly by providing it to Users","https://w3id.org/dpv/tech#Actor","","https://w3id.org/dpv/tech#Actor","","2024-05-09","","tech","https://w3id.org/dpv/tech"
"DataStorage","class","https://w3id.org/dpv/tech#DataStorage","Data Storage","Technology associated with storage of data","https://w3id.org/dpv#Technology","","https://w3id.org/dpv/tech#Software","","2022-06-15","","tech","https://w3id.org/dpv/tech"
"Database","class","https://w3id.org/dpv/tech#Database","Database","A database, database management system (DBMS), or application database","https://w3id.org/dpv#Technology","","https://w3id.org/dpv/tech#DataStorage","","2022-06-15","","tech","https://w3id.org/dpv/tech"
"Decision","class","https://w3id.org/dpv/tech#Decision","Decision","A conclusion or determination of an action or choice in the context of technologies","","https://w3id.org/dpv/tech#InputOutput","https://w3id.org/dpv/tech#InputOutput","Decision is a concept referring to activities or tasks in the context of technologies producing or using them as inputs or outputs","2024-12-01","","tech","https://w3id.org/dpv/tech"
"Deployer","class","https://w3id.org/dpv/tech#Deployer","Deployer","Actor that deploys Technology","https://w3id.org/dpv/tech#Actor","","https://w3id.org/dpv/tech#Actor","","2024-05-09","","tech","https://w3id.org/dpv/tech"
"DeploymentLocation","class","https://w3id.org/dpv/tech#DeploymentLocation","Deployment Location","Location for where technology is deployed and used","","https://w3id.org/dpv#Location","https://w3id.org/dpv#Location","","2022-06-15","","tech","https://w3id.org/dpv/tech"
"Designer","class","https://w3id.org/dpv/tech#Designer","Designer","Actor that designs Technology","https://w3id.org/dpv/tech#Actor","","https://w3id.org/dpv/tech#Actor","","2024-05-09","","tech","https://w3id.org/dpv/tech"
"DesktopPC","class","https://w3id.org/dpv/tech#DesktopPC","Desktop PC","A non-portable or fixed personal computer","https://w3id.org/dpv#Technology","","https://w3id.org/dpv/tech#PersonalComputer","","2022-06-15","","tech","https://w3id.org/dpv/tech"
"Developer","class","https://w3id.org/dpv/tech#Developer","Developer","Actor that develops Technology","https://w3id.org/dpv/tech#Actor","","https://w3id.org/dpv/tech#Producer","","2024-05-09","","tech","https://w3id.org/dpv/tech"
"DevelopmentPlan","class","https://w3id.org/dpv/tech#DevelopmentPlan","Development Plan","Plan associated with developing technology","https://w3id.org/dpv/tech#Documentation","","https://w3id.org/dpv/tech#Plan","","2024-05-09","","tech","https://w3id.org/dpv/tech"
"Device","class","https://w3id.org/dpv/tech#Device","Device","Device or computing device","https://w3id.org/dpv#Technology","","https://w3id.org/dpv/tech#Hardware","","2022-06-15","","tech","https://w3id.org/dpv/tech"
"Distributor","class","https://w3id.org/dpv/tech#Distributor","Distributor","Actor that distributes the Technology","https://w3id.org/dpv/tech#Actor","","https://w3id.org/dpv/tech#Actor","","2024-05-09","","tech","https://w3id.org/dpv/tech"
"Documentation","class","https://w3id.org/dpv/tech#Documentation","Documentation","Information describing use, functionality, design, or other technical aspects of the Technology","","","","","2024-05-09","","tech","https://w3id.org/dpv/tech"
"Evaluator","class","https://w3id.org/dpv/tech#Evaluator","Evaluator","Actor that evaluates the performance of Technology","https://w3id.org/dpv/tech#Actor","","https://w3id.org/dpv/tech#Partner","","2024-05-09","","tech","https://w3id.org/dpv/tech"
"Function","class","https://w3id.org/dpv/tech#Function","Function","Expression of what goals or purposes the technology's capabilities are being used towards or developed for","","","","Function is a broad concept that can include purposes such as identify verification, capability such as image recognition, or specific security measures such as encryption","2024-05-09","","tech","https://w3id.org/dpv/tech"
"GNULinux","class","https://w3id.org/dpv/tech#GNULinux","GNU/Linux","GNU/Linux operating system","https://w3id.org/dpv#Technology","","https://w3id.org/dpv/tech#OS","","2022-06-15","","tech","https://w3id.org/dpv/tech"
"GPS","class","https://w3id.org/dpv/tech#GPS","GPS","Technology utilising GPS","https://w3id.org/dpv/tech#CommunicationMechanism","","https://w3id.org/dpv/tech#CommunicationMechanism","","2024-05-09","","tech","https://w3id.org/dpv/tech"
"Guide","class","https://w3id.org/dpv/tech#Guide","Guide","Documentation that provides guidance regarding the technology","https://w3id.org/dpv/tech#Documentation","","https://w3id.org/dpv/tech#Documentation","","2024-05-09","","tech","https://w3id.org/dpv/tech"
"Hardware","class","https://w3id.org/dpv/tech#Hardware","Hardware","Physical parts or components of the technology","https://w3id.org/dpv#Technology","","https://w3id.org/dpv#Technology","","2022-06-15","","tech","https://w3id.org/dpv/tech"
"ImageContent","class","https://w3id.org/dpv/tech#ImageContent","Image Content","Content that is or has an image component","","https://w3id.org/dpv/tech#Content","https://w3id.org/dpv/tech#Content","","2024-12-01","","tech","https://w3id.org/dpv/tech"
"Importer","class","https://w3id.org/dpv/tech#Importer","Importer","Actor that imports the Technology within a jurisdiction","https://w3id.org/dpv/tech#Actor","","https://w3id.org/dpv/tech#Actor","","2024-05-09","","tech","https://w3id.org/dpv/tech"
"Infrastructure","class","https://w3id.org/dpv/tech#Infrastructure","Infrastructure as a Service (IaaS) Provision","The foundational hardware, software, and other resources to support the operation of systems or services","https://w3id.org/dpv#Technology","","https://w3id.org/dpv#Technology","","2024-12-01","","tech","https://w3id.org/dpv/tech"
"Input","class","https://w3id.org/dpv/tech#Input","Input","Input to a technology","","https://w3id.org/dpv/tech#InputOutput","https://w3id.org/dpv/tech#InputOutput","","2024-12-01","","tech","https://w3id.org/dpv/tech"
"InputAction","class","https://w3id.org/dpv/tech#InputAction","Input Action","Action provided as an input to a technology","","https://w3id.org/dpv/tech#Action;https://w3id.org/dpv/tech#Input","https://w3id.org/dpv/tech#Action;https://w3id.org/dpv/tech#Input","Action can mean a physical action, such as the movements involved in robotics","2024-12-01","","tech","https://w3id.org/dpv/tech"
"InputData","class","https://w3id.org/dpv/tech#InputData","Input Data","Data that is provided an input to a technology","","https://w3id.org/dpv#Data;https://w3id.org/dpv/tech#Input","https://w3id.org/dpv#Data;https://w3id.org/dpv/tech#Input","","2024-12-01","","tech","https://w3id.org/dpv/tech"
"InputOutput","class","https://w3id.org/dpv/tech#InputOutput","Input/Output","Forms of inputs and outputs associated with a technology","","","","","2024-12-17","","tech","https://w3id.org/dpv/tech"
"Installer","class","https://w3id.org/dpv/tech#Installer","Installer","Actor that installs Technology","https://w3id.org/dpv/tech#Actor","","https://w3id.org/dpv/tech#Actor","","2024-05-09","","tech","https://w3id.org/dpv/tech"
"Instructions","class","https://w3id.org/dpv/tech#Instructions","Instructions","Instructions related to technology","https://w3id.org/dpv/tech#Documentation","","https://w3id.org/dpv/tech#Documentation","","2024-05-09","","tech","https://w3id.org/dpv/tech"
"IntegratedCircuit","class","https://w3id.org/dpv/tech#IntegratedCircuit","IntegratedCircuit","A integrated electronic chip containing interconnected components to perform specific functions","https://w3id.org/dpv#Technology","","https://w3id.org/dpv/tech#Hardware","","2024-12-01","","tech","https://w3id.org/dpv/tech"
"IntendedUse","class","https://w3id.org/dpv/tech#IntendedUse","Intended Use","Describes the 'intended' use of the technology","","","","Intended use can be used to describe how the developer or provider of technology intends it to be used e.g. use a database to store data, and to describe the plan or 'intent' to use the technology by a user or operator e.g. use a database to store and analyse data. Intended Use can involve any concept e.g. DPV's purpose, processing, tech/org measures, and can be low-level purely technical uses such as store data or high-level goals such as legal compliance. Intended Use only describes the intent or ex-ante intention, and may be different from how the technology is being actually used - which is indicated by using isImplementedUsingTechnology in a process or other relevant context.","2024-05-22","","tech","https://w3id.org/dpv/tech"
"Internet","class","https://w3id.org/dpv/tech#Internet","Internet","Technology utilising internet","https://w3id.org/dpv/tech#CommunicationMechanism","","https://w3id.org/dpv/tech#Networking","","2024-05-09","","tech","https://w3id.org/dpv/tech"
"IoT","class","https://w3id.org/dpv/tech#IoT","Internet of Things (IoT)","IoT is the infrastructure of interconnected entities, people, systems and information resources together with services that process and react to information from the physical world and virtual world","https://w3id.org/dpv#Technology","","https://w3id.org/dpv/tech#Hardware","","2024-12-01","","tech","https://w3id.org/dpv/tech"
"IoTDevice","class","https://w3id.org/dpv/tech#IoTDevice","IoT Device","An entity of an IoT system that interacts and communicates with the physical world through sensing or actuating","https://w3id.org/dpv#Technology","","https://w3id.org/dpv/tech#Device;https://w3id.org/dpv/tech#IoT","","2024-12-01","","tech","https://w3id.org/dpv/tech"
"IoTSystem","class","https://w3id.org/dpv/tech#IoTSystem","IoT System","A specific system that is an implementation or application of the IoT framework and contains interconnected IoT devices and their communication network along with other hardware and software required for providing functionalities","https://w3id.org/dpv#Technology","","https://w3id.org/dpv/tech#IoT;https://w3id.org/dpv/tech#System","","2024-12-01","","tech","https://w3id.org/dpv/tech"
"LaptopPC","class","https://w3id.org/dpv/tech#LaptopPC","Laptop PC","A portal personal computer","https://w3id.org/dpv#Technology","","https://w3id.org/dpv/tech#PersonalComputer","","2022-06-15","","tech","https://w3id.org/dpv/tech"
"License","class","https://w3id.org/dpv/tech#License","License","A legal agreement that allows or provides a license for the use or other operations involving a technology","","https://w3id.org/dpv#LicenseAgreement","https://w3id.org/dpv#LicenseAgreement","This concept is derived from license agreements and contracts which are legal bases, and therefore can also be used as a legal basis","2024-12-01","","tech","https://w3id.org/dpv/tech"
"LifecycleStage","class","https://w3id.org/dpv/tech#LifecycleStage","Lifecycle Stage","A stage within the lifecycle of technology","","","","","2024-12-01","","tech","https://w3id.org/dpv/tech"
"LocalNetwork","class","https://w3id.org/dpv/tech#LocalNetwork","Local Network","Technology utilising local networking","https://w3id.org/dpv/tech#CommunicationMechanism","","https://w3id.org/dpv/tech#Networking","","2024-05-09","","tech","https://w3id.org/dpv/tech"
"LocalStorage","class","https://w3id.org/dpv/tech#LocalStorage","Local Storage","Storage that is local (e.g. on device)","https://w3id.org/dpv#Technology","","https://w3id.org/dpv/tech#DataStorage","","2022-06-15","","tech","https://w3id.org/dpv/tech"
"MSWindows","class","https://w3id.org/dpv/tech#MSWindows","Microsoft Windows","Microsoft Windows operating system","https://w3id.org/dpv#Technology","","https://w3id.org/dpv/tech#OS","","2022-06-15","","tech","https://w3id.org/dpv/tech"
"Maintainer","class","https://w3id.org/dpv/tech#Maintainer","Maintainer","Actor that maintains Technology","https://w3id.org/dpv/tech#Actor","","https://w3id.org/dpv/tech#Actor","","2024-05-09","","tech","https://w3id.org/dpv/tech"
"Manual","class","https://w3id.org/dpv/tech#Manual","Manual","Documentation that provides instructions for using, maintaining, developing, or performing other activities regarding the technology","https://w3id.org/dpv/tech#Documentation","","https://w3id.org/dpv/tech#Documentation","","2024-05-09","","tech","https://w3id.org/dpv/tech"
"Manufacturer","class","https://w3id.org/dpv/tech#Manufacturer","Manufacturer","Actor that manufactures Technology","https://w3id.org/dpv/tech#Actor","","https://w3id.org/dpv/tech#Actor","","2024-05-09","","tech","https://w3id.org/dpv/tech"
"MarketAvailabilityStatus","class","https://w3id.org/dpv/tech#MarketAvailabilityStatus","Market Availability Status","Status indicating whether Technology is available on the market","","https://w3id.org/dpv/tech#TechnologyStatus","https://w3id.org/dpv/tech#TechnologyStatus","","2024-05-09","","tech","https://w3id.org/dpv/tech"
"MarketAvailable","class","https://w3id.org/dpv/tech#MarketAvailable","Market Available","Status indicating Technology is available on the market","https://w3id.org/dpv/tech#MarketAvailabilityStatus","","https://w3id.org/dpv/tech#MarketAvailabilityStatus","","2024-05-09","","tech","https://w3id.org/dpv/tech"
"MarketUnavailable","class","https://w3id.org/dpv/tech#MarketUnavailable","Market Unavailable","Status indicating Technology is unavailable on the market","https://w3id.org/dpv/tech#MarketAvailabilityStatus","","https://w3id.org/dpv/tech#MarketAvailabilityStatus","","2024-05-09","","tech","https://w3id.org/dpv/tech"
"MobilePhone","class","https://w3id.org/dpv/tech#MobilePhone","Mobile Phone","Mobile telephone","https://w3id.org/dpv#Technology","","https://w3id.org/dpv/tech#Telephone","","2022-06-15","","tech","https://w3id.org/dpv/tech"
"Model","class","https://w3id.org/dpv/tech#Model","Model","A simplified representation or abstraction of a system, process, or concept","https://w3id.org/dpv#Technology","","https://w3id.org/dpv#Technology","","2024-12-01","","tech","https://w3id.org/dpv/tech"
"Networking","class","https://w3id.org/dpv/tech#Networking","Networking","Technology utilising networking","https://w3id.org/dpv/tech#CommunicationMechanism","","https://w3id.org/dpv/tech#CommunicationMechanism","","2024-05-09","","tech","https://w3id.org/dpv/tech"
"NotProvided","class","https://w3id.org/dpv/tech#NotProvided","Not Provided","Status indicating Technology has not been provided","https://w3id.org/dpv/tech#ProvisionStatus","","https://w3id.org/dpv/tech#ProvisionStatus","","2024-05-09","","tech","https://w3id.org/dpv/tech"
"OS","class","https://w3id.org/dpv/tech#OS","Operating System (OS)","Software for managing hardware and other software","https://w3id.org/dpv#Technology","","https://w3id.org/dpv/tech#Software","","2022-06-15","","tech","https://w3id.org/dpv/tech"
"OperatingEnvironment","class","https://w3id.org/dpv/tech#OperatingEnvironment","Operating Environment","The environment within which the technology operates","","","","Environment here is a broad term used to refer to the immediate surroundings and parts of it that form the context of where the technology operates, for example a room or in open air where specific machines are set up. This helps describe the expectations and set up of systems and, to specify and compare them against ideal conditions or environments","2025-05-29","","tech","https://w3id.org/dpv/tech"
"OperatingFactor","class","https://w3id.org/dpv/tech#OperatingFactor","Operating Factor","A 'factor' affecting the operation and outcomes of the technology","","","","Examples of operating factor could be equipment characteristics, lighting conditions for camera operations, connectivity for communications. This helps indicate whether specific factors are ideal i.e. they will give the best performance, or are problematic i.e. they will cause issues","2025-05-29","","tech","https://w3id.org/dpv/tech"
"Operator","class","https://w3id.org/dpv/tech#Operator","Operator","Actor that operates the Technology","https://w3id.org/dpv/tech#Actor","","https://w3id.org/dpv/tech#Actor","Operator and User are similar concepts but may refer to different actors, for example in the scenario where the user determines what actions to perform on the technology and the operator executes these actions by operating the technology","2024-05-09","","tech","https://w3id.org/dpv/tech"
"Output","class","https://w3id.org/dpv/tech#Output","Output","Output from a technology","","https://w3id.org/dpv/tech#InputOutput","https://w3id.org/dpv/tech#InputOutput","","2024-12-01","","tech","https://w3id.org/dpv/tech"
"OutputAction","class","https://w3id.org/dpv/tech#OutputAction","Output Action","Action produced as an output from a technology","","https://w3id.org/dpv/tech#Action;https://w3id.org/dpv/tech#Output","https://w3id.org/dpv/tech#Action;https://w3id.org/dpv/tech#Output","Action can mean a physical action, such as the movements involved in robotics","2024-12-01","","tech","https://w3id.org/dpv/tech"
"OutputData","class","https://w3id.org/dpv/tech#OutputData","Output Data","Data that is produced as an output from a technology","","https://w3id.org/dpv#Data;https://w3id.org/dpv/tech#Output","https://w3id.org/dpv#Data;https://w3id.org/dpv/tech#Output","","2024-12-01","","tech","https://w3id.org/dpv/tech"
"Owner","class","https://w3id.org/dpv/tech#Owner","Owner","Actor that owns Technology","https://w3id.org/dpv/tech#Actor","","https://w3id.org/dpv/tech#Actor","","2024-05-09","","tech","https://w3id.org/dpv/tech"
"Partner","class","https://w3id.org/dpv/tech#Partner","Partner","Actor that provides services in the context of Technology","https://w3id.org/dpv/tech#Actor","","https://w3id.org/dpv/tech#Actor","""Partner"" is a vague term and should not be used - instead the more specific terms provided in this vocabulary should be used. Partner refers to entities that provide services for the technology (as opposed to for using the technology) - for example to further develop or refine it, or to test or audit it.","2024-05-09","","tech","https://w3id.org/dpv/tech"
"PersonalComputer","class","https://w3id.org/dpv/tech#PersonalComputer","Personal Computer (PC)","A computing device intended for individual use","https://w3id.org/dpv#Technology","","https://w3id.org/dpv/tech#Device","","2022-06-15","","tech","https://w3id.org/dpv/tech"
"Plan","class","https://w3id.org/dpv/tech#Plan","Plan","Plan associated with using, maintaining, developing, or performing other activities associated with technology","https://w3id.org/dpv/tech#Documentation","","https://w3id.org/dpv/tech#Documentation","","2024-05-09","","tech","https://w3id.org/dpv/tech"
"Platform","class","https://w3id.org/dpv/tech#Platform","Platform","A digital environment that provides tools, infrastructure, and services for developing, deploying, and running applications","https://w3id.org/dpv#Technology","","https://w3id.org/dpv#Technology","","2024-12-01","","tech","https://w3id.org/dpv/tech"
"Prediction","class","https://w3id.org/dpv/tech#Prediction","Prediction","An inference or prediction of an action or data or decision in the context of technologies","","https://w3id.org/dpv/tech#InputOutput","https://w3id.org/dpv/tech#InputOutput","Prediction is a concept referring to activities or tasks in the context of technologies producing or using them as inputs or outputs","2024-12-01","","tech","https://w3id.org/dpv/tech"
"Producer","class","https://w3id.org/dpv/tech#Producer","Producer","Actor that produces Technology","https://w3id.org/dpv/tech#Actor","","https://w3id.org/dpv/tech#Actor","","2024-05-09","","tech","https://w3id.org/dpv/tech"
"Provided","class","https://w3id.org/dpv/tech#Provided","Provided","Status indicating Technology has been provided","https://w3id.org/dpv/tech#ProvisionStatus","","https://w3id.org/dpv/tech#ProvisionStatus","","2024-05-09","","tech","https://w3id.org/dpv/tech"
"ProvidedAsAlgorithmic","class","https://w3id.org/dpv/tech#ProvidedAsAlgorithmic","Provided as AlgorithmicProvision","Technology provided as an algorithm or method","https://w3id.org/dpv/tech#ProvisionMethod","","https://w3id.org/dpv/tech#ProvisionMethod","","2022-06-15","2024-12-01","tech","https://w3id.org/dpv/tech"
