"term","type","iri","label","definition","dpvtype","subclassof","hasbroader","scopenote","created","modified","vocab","namespace"
"DigitalHealthAuthorityActivityReport","class","https://w3id.org/dpv/legal/eu/ehds#DigitalHealthAuthorityActivityReport","Digital Health Authority Activity Report","Document containing an overview of activities reported by a digital health authority","https://w3id.org/dpv#OrganisationalMeasure","","https://w3id.org/dpv#RecordsOfActivities","","2025-10-28","","eu-ehds","https://w3id.org/dpv/legal/eu/ehds"
"EHRSystemInformationSheet","class","https://w3id.org/dpv/legal/eu/ehds#EHRSystemInformationSheet","EHR System Information Sheet","Technical documentation with information related to the EHR system, including its manufacturer, intended purpose and supported standards","https://w3id.org/dpv#OrganisationalMeasure","","https://w3id.org/dpv#OrganisationalMeasure","","2025-10-28","","eu-ehds","https://w3id.org/dpv/legal/eu/ehds"
"EHRSystemTechnicalDocumentation","class","https://w3id.org/dpv/legal/eu/ehds#EHRSystemTechnicalDocumentation","EHR System Technical Documentation","Technical documentation that demonstrates that the EHR system manufacturers comply with the requirements laid down in Annex II","https://w3id.org/dpv#OrganisationalMeasure","","https://w3id.org/dpv#OrganisationalMeasure","","2025-10-28","","eu-ehds","https://w3id.org/dpv/legal/eu/ehds"
"EUDatabaseForRegistrationOfEHRSystems","class","https://w3id.org/dpv/legal/eu/ehds#EUDatabaseForRegistrationOfEHRSystems","EU Database for Registration of EHR Systems","Publicly available database established by the European Commission to maintain data on EHR systems for which an EU declaration of conformity has been issued according to EHDS Article 39","https://w3id.org/dpv#OrganisationalMeasure","","https://w3id.org/dpv#OrganisationalMeasure","","2025-10-28","","eu-ehds","https://w3id.org/dpv/legal/eu/ehds"
"EUDatabaseForRegistrationOfWellnessApplications","class","https://w3id.org/dpv/legal/eu/ehds#EUDatabaseForRegistrationOfWellnessApplications","EU Database for Registration of Wellness Applications","Publicly available database established by the European Commission to maintain data on wellness applications for which a label has been issued pursuant to EHDS Article 47","https://w3id.org/dpv#OrganisationalMeasure","","https://w3id.org/dpv#OrganisationalMeasure","","2025-10-28","","eu-ehds","https://w3id.org/dpv/legal/eu/ehds"
"EUDeclarationOfConformity","class","https://w3id.org/dpv/legal/eu/ehds#EUDeclarationOfConformity","EU Declaration of Conformity","Declaration of conformity by the EU stating that the manufacturer of an EHR system has demonstrated that the essential requirements laid down in EHDS Annex II have been fulfilled","https://w3id.org/dpv#OrganisationalMeasure","","https://w3id.org/dpv#CertificationSeal","","2025-10-28","","eu-ehds","https://w3id.org/dpv/legal/eu/ehds"
"EuropeanDigitalTestingEnvironment","class","https://w3id.org/dpv/legal/eu/ehds#EuropeanDigitalTestingEnvironment","European Digital Testing Environment","Data processing environment for the assessment of harmonised software components of EHR systems","https://w3id.org/dpv#OrganisationalMeasure","","https://w3id.org/dpv#SecureProcessingEnvironment","","2025-10-28","","eu-ehds","https://w3id.org/dpv/legal/eu/ehds"
"WellnessApplicationLabel","class","https://w3id.org/dpv/legal/eu/ehds#WellnessApplicationLabel","Wellness Application Label","Label issued by the manufacturer of the wellness application that indicating its compliance with the common specifications referred to in EHDS Article 36 and the requirements laid down in EHDS Annex II","https://w3id.org/dpv#OrganisationalMeasure","","https://w3id.org/dpv#CertificationSeal","","2025-10-28","","eu-ehds","https://w3id.org/dpv/legal/eu/ehds"
